{
  "address": "0xbE1b58B66b0395cDC4A9C582b16DE80fc7a2EC5a",
  "abi": [
    {
      "anonymous": false,
      "inputs": [
        {
          "indexed": true,
          "internalType": "address",
          "name": "auction",
          "type": "address"
        },
        {
          "indexed": false,
          "internalType": "address",
          "name": "seller",
          "type": "address"
        },
        {
          "indexed": false,
          "internalType": "address",
          "name": "nftAddress",
          "type": "address"
        },
        {
          "indexed": true,
          "internalType": "uint256",
          "name": "tokenId",
          "type": "uint256"
        },
        {
          "indexed": true,
          "internalType": "address",
          "name": "winner",
          "type": "address"
        },
        {
          "indexed": false,
          "internalType": "uint256",
          "name": "winningBid",
          "type": "uint256"
        },
        {
          "indexed": false,
          "internalType": "uint256",
          "name": "time",
          "type": "uint256"
        },
        {
          "indexed": false,
          "internalType": "bool",
          "name": "pass",
          "type": "bool"
        }
      ],
      "name": "AuctionAuditResult",
      "type": "event"
    },
    {
      "anonymous": false,
      "inputs": [
        {
          "indexed": true,
          "internalType": "address",
          "name": "auction",
          "type": "address"
        },
        {
          "indexed": true,
          "internalType": "address",
          "name": "nftAddress",
          "type": "address"
        },
        {
          "indexed": true,
          "internalType": "uint256",
          "name": "tokenId",
          "type": "uint256"
        },
        {
          "indexed": false,
          "internalType": "address",
          "name": "bidder",
          "type": "address"
        },
        {
          "indexed": false,
          "internalType": "uint256",
          "name": "bidAmount",
          "type": "uint256"
        },
        {
          "indexed": false,
          "internalType": "uint256",
          "name": "bidTime",
          "type": "uint256"
        }
      ],
      "name": "AuctionBidPlaced",
      "type": "event"
    },
    {
      "anonymous": false,
      "inputs": [
        {
          "indexed": true,
          "internalType": "address",
          "name": "auction",
          "type": "address"
        },
        {
          "indexed": false,
          "internalType": "address",
          "name": "seller",
          "type": "address"
        },
        {
          "indexed": false,
          "internalType": "address",
          "name": "nftAddress",
          "type": "address"
        },
        {
          "indexed": true,
          "internalType": "uint256",
          "name": "tokenId",
          "type": "uint256"
        },
        {
          "indexed": false,
          "internalType": "uint256",
          "name": "closeTime",
          "type": "uint256"
        },
        {
          "indexed": false,
          "internalType": "address",
          "name": "winner",
          "type": "address"
        },
        {
          "indexed": false,
          "internalType": "uint256",
          "name": "winningBid",
          "type": "uint256"
        },
        {
          "indexed": true,
          "internalType": "enum Constants.AuctionEndState",
          "name": "endState",
          "type": "uint8"
        }
      ],
      "name": "AuctionClosed",
      "type": "event"
    },
    {
      "anonymous": false,
      "inputs": [
        {
          "indexed": true,
          "internalType": "address",
          "name": "auction",
          "type": "address"
        },
        {
          "indexed": true,
          "internalType": "address",
          "name": "nftAddress",
          "type": "address"
        },
        {
          "indexed": true,
          "internalType": "uint256",
          "name": "tokenId",
          "type": "uint256"
        },
        {
          "indexed": false,
          "internalType": "address",
          "name": "bidder",
          "type": "address"
        },
        {
          "indexed": false,
          "internalType": "uint256",
          "name": "depositAmount",
          "type": "uint256"
        },
        {
          "indexed": false,
          "internalType": "uint256",
          "name": "depositTime",
          "type": "uint256"
        }
      ],
      "name": "AuctionDepositPlaced",
      "type": "event"
    },
    {
      "anonymous": false,
      "inputs": [
        {
          "indexed": true,
          "internalType": "address",
          "name": "auction",
          "type": "address"
        },
        {
          "indexed": true,
          "internalType": "address",
          "name": "nftAddress",
          "type": "address"
        },
        {
          "indexed": true,
          "internalType": "uint256",
          "name": "tokenId",
          "type": "uint256"
        },
        {
          "indexed": false,
          "internalType": "address",
          "name": "bidder",
          "type": "address"
        },
        {
          "indexed": false,
          "internalType": "uint256",
          "name": "retrieveAmount",
          "type": "uint256"
        },
        {
          "indexed": false,
          "internalType": "uint256",
          "name": "retrievalTime",
          "type": "uint256"
        }
      ],
      "name": "AuctionDepositRetrieved",
      "type": "event"
    },
    {
      "anonymous": false,
      "inputs": [
        {
          "indexed": true,
          "internalType": "address",
          "name": "auction",
          "type": "address"
        },
        {
          "indexed": false,
          "internalType": "address",
          "name": "nftAddress",
          "type": "address"
        },
        {
          "indexed": false,
          "internalType": "uint256",
          "name": "tokenId",
          "type": "uint256"
        },
        {
          "indexed": true,
          "internalType": "address",
          "name": "winner",
          "type": "address"
        },
        {
          "indexed": false,
          "internalType": "address",
          "name": "seller",
          "type": "address"
        },
        {
          "indexed": true,
          "internalType": "uint256",
          "name": "paidAmount",
          "type": "uint256"
        },
        {
          "indexed": false,
          "internalType": "uint256",
          "name": "paidTime",
          "type": "uint256"
        }
      ],
      "name": "AuctionFullSettlementPaid",
      "type": "event"
    },
    {
      "anonymous": false,
      "inputs": [
        {
          "indexed": true,
          "internalType": "address",
          "name": "auction",
          "type": "address"
        },
        {
          "indexed": false,
          "internalType": "address",
          "name": "seller",
          "type": "address"
        },
        {
          "indexed": false,
          "internalType": "address",
          "name": "nftAddress",
          "type": "address"
        },
        {
          "indexed": true,
          "internalType": "uint256",
          "name": "tokenId",
          "type": "uint256"
        },
        {
          "indexed": true,
          "internalType": "address",
          "name": "winner",
          "type": "address"
        },
        {
          "indexed": false,
          "internalType": "uint256",
          "name": "winningBid",
          "type": "uint256"
        },
        {
          "indexed": false,
          "internalType": "uint256",
          "name": "startTime",
          "type": "uint256"
        },
        {
          "indexed": false,
          "internalType": "uint256",
          "name": "endTime",
          "type": "uint256"
        }
      ],
      "name": "AuctionPendingPayment",
      "type": "event"
    },
    {
      "anonymous": false,
      "inputs": [
        {
          "indexed": true,
          "internalType": "address",
          "name": "auction",
          "type": "address"
        },
        {
          "indexed": false,
          "internalType": "address",
          "name": "seller",
          "type": "address"
        },
        {
          "indexed": true,
          "internalType": "address",
          "name": "nftAddress",
          "type": "address"
        },
        {
          "indexed": true,
          "internalType": "uint256",
          "name": "tokenId",
          "type": "uint256"
        },
        {
          "indexed": false,
          "internalType": "uint256",
          "name": "registerTime",
          "type": "uint256"
        }
      ],
      "name": "AuctionRegistered",
      "type": "event"
    },
    {
      "anonymous": false,
      "inputs": [
        {
          "indexed": true,
          "internalType": "address",
          "name": "auction",
          "type": "address"
        },
        {
          "indexed": false,
          "internalType": "address",
          "name": "seller",
          "type": "address"
        },
        {
          "indexed": true,
          "internalType": "address",
          "name": "nftAddress",
          "type": "address"
        },
        {
          "indexed": true,
          "internalType": "uint256",
          "name": "tokenId",
          "type": "uint256"
        },
        {
          "indexed": false,
          "internalType": "uint256",
          "name": "depositWei",
          "type": "uint256"
        },
        {
          "indexed": false,
          "internalType": "uint256",
          "name": "bidStartTime",
          "type": "uint256"
        },
        {
          "indexed": false,
          "internalType": "uint256",
          "name": "bidEndTime",
          "type": "uint256"
        },
        {
          "indexed": false,
          "internalType": "uint256",
          "name": "startingBid",
          "type": "uint256"
        }
      ],
      "name": "AuctionStartedBidding",
      "type": "event"
    },
    {
      "anonymous": false,
      "inputs": [
        {
          "indexed": true,
          "internalType": "address",
          "name": "auction",
          "type": "address"
        },
        {
          "indexed": false,
          "internalType": "address",
          "name": "seller",
          "type": "address"
        },
        {
          "indexed": false,
          "internalType": "address",
          "name": "nftAddress",
          "type": "address"
        },
        {
          "indexed": true,
          "internalType": "uint256",
          "name": "tokenId",
          "type": "uint256"
        },
        {
          "indexed": true,
          "internalType": "address",
          "name": "winner",
          "type": "address"
        },
        {
          "indexed": false,
          "internalType": "uint256",
          "name": "winningBid",
          "type": "uint256"
        },
        {
          "indexed": false,
          "internalType": "uint256",
          "name": "platformCharge",
          "type": "uint256"
        },
        {
          "indexed": false,
          "internalType": "uint256",
          "name": "startTime",
          "type": "uint256"
        },
        {
          "indexed": false,
          "internalType": "uint256",
          "name": "endTime",
          "type": "uint256"
        }
      ],
      "name": "AuctionVerifyingWinner",
      "type": "event"
    },
    {
      "anonymous": false,
      "inputs": [
        {
          "indexed": true,
          "internalType": "address",
          "name": "platformOwner",
          "type": "address"
        },
        {
          "indexed": false,
          "internalType": "address",
          "name": "payer",
          "type": "address"
        },
        {
          "indexed": true,
          "internalType": "address",
          "name": "auction",
          "type": "address"
        },
        {
          "indexed": false,
          "internalType": "enum Constants.PlatformEarnings",
          "name": "earningType",
          "type": "uint8"
        },
        {
          "indexed": false,
          "internalType": "uint256",
          "name": "time",
          "type": "uint256"
        }
      ],
      "name": "PlatformEarnings",
      "type": "event"
    },
    {
      "anonymous": false,
      "inputs": [
        {
          "indexed": true,
          "internalType": "address",
          "name": "auction",
          "type": "address"
        },
        {
          "indexed": false,
          "internalType": "address",
          "name": "nftAddress",
          "type": "address"
        },
        {
          "indexed": false,
          "internalType": "uint256",
          "name": "tokenId",
          "type": "uint256"
        },
        {
          "indexed": true,
          "internalType": "address",
          "name": "seller",
          "type": "address"
        },
        {
          "indexed": true,
          "internalType": "uint256",
          "name": "retrieveAmount",
          "type": "uint256"
        },
        {
          "indexed": false,
          "internalType": "uint256",
          "name": "retrievalTime",
          "type": "uint256"
        }
      ],
      "name": "SellerEarningsRetrieved",
      "type": "event"
    },
    {
      "anonymous": false,
      "inputs": [
        {
          "indexed": true,
          "internalType": "address",
          "name": "auction",
          "type": "address"
        },
        {
          "indexed": false,
          "internalType": "address",
          "name": "nftAddress",
          "type": "address"
        },
        {
          "indexed": false,
          "internalType": "uint256",
          "name": "tokenId",
          "type": "uint256"
        },
        {
          "indexed": false,
          "internalType": "address",
          "name": "winner",
          "type": "address"
        },
        {
          "indexed": true,
          "internalType": "uint256",
          "name": "refundAmount",
          "type": "uint256"
        },
        {
          "indexed": false,
          "internalType": "uint256",
          "name": "retrievalTime",
          "type": "uint256"
        }
      ],
      "name": "winnerPaymentRefunded",
      "type": "event"
    },
    {
      "inputs": [
        {
          "internalType": "address",
          "name": "_auction",
          "type": "address"
        },
        {
          "internalType": "address",
          "name": "_seller",
          "type": "address"
        },
        {
          "internalType": "address",
          "name": "_nftAddress",
          "type": "address"
        },
        {
          "internalType": "uint256",
          "name": "_tokenId",
          "type": "uint256"
        },
        {
          "internalType": "address",
          "name": "_winner",
          "type": "address"
        },
        {
          "internalType": "uint256",
          "name": "_winningBid",
          "type": "uint256"
        },
        {
          "internalType": "uint256",
          "name": "_time",
          "type": "uint256"
        },
        {
          "internalType": "bool",
          "name": "_pass",
          "type": "bool"
        }
      ],
      "name": "emitAuctionAuditResult",
      "outputs": [],
      "stateMutability": "nonpayable",
      "type": "function"
    },
    {
      "inputs": [
        {
          "internalType": "address",
          "name": "_auction",
          "type": "address"
        },
        {
          "internalType": "address",
          "name": "_nftAddress",
          "type": "address"
        },
        {
          "internalType": "uint256",
          "name": "_tokenId",
          "type": "uint256"
        },
        {
          "internalType": "address",
          "name": "_bidder",
          "type": "address"
        },
        {
          "internalType": "uint256",
          "name": "_bidAmount",
          "type": "uint256"
        },
        {
          "internalType": "uint256",
          "name": "_bidTime",
          "type": "uint256"
        }
      ],
      "name": "emitAuctionBidPlaced",
      "outputs": [],
      "stateMutability": "nonpayable",
      "type": "function"
    },
    {
      "inputs": [
        {
          "internalType": "address",
          "name": "_auction",
          "type": "address"
        },
        {
          "internalType": "address",
          "name": "_seller",
          "type": "address"
        },
        {
          "internalType": "address",
          "name": "_nftAddress",
          "type": "address"
        },
        {
          "internalType": "uint256",
          "name": "_tokenId",
          "type": "uint256"
        },
        {
          "internalType": "uint256",
          "name": "_closeTime",
          "type": "uint256"
        },
        {
          "internalType": "address",
          "name": "_winner",
          "type": "address"
        },
        {
          "internalType": "uint256",
          "name": "_winningBid",
          "type": "uint256"
        },
        {
          "internalType": "enum Constants.AuctionEndState",
          "name": "_endState",
          "type": "uint8"
        }
      ],
      "name": "emitAuctionClosed",
      "outputs": [],
      "stateMutability": "nonpayable",
      "type": "function"
    },
    {
      "inputs": [
        {
          "internalType": "address",
          "name": "_auction",
          "type": "address"
        },
        {
          "internalType": "address",
          "name": "_nftAddress",
          "type": "address"
        },
        {
          "internalType": "uint256",
          "name": "_tokenId",
          "type": "uint256"
        },
        {
          "internalType": "address",
          "name": "_bidder",
          "type": "address"
        },
        {
          "internalType": "uint256",
          "name": "_depositAmount",
          "type": "uint256"
        },
        {
          "internalType": "uint256",
          "name": "_depositTime",
          "type": "uint256"
        }
      ],
      "name": "emitAuctionDepositPlaced",
      "outputs": [],
      "stateMutability": "nonpayable",
      "type": "function"
    },
    {
      "inputs": [
        {
          "internalType": "address",
          "name": "_auction",
          "type": "address"
        },
        {
          "internalType": "address",
          "name": "_nftAddress",
          "type": "address"
        },
        {
          "internalType": "uint256",
          "name": "_tokenId",
          "type": "uint256"
        },
        {
          "internalType": "address",
          "name": "_bidder",
          "type": "address"
        },
        {
          "internalType": "uint256",
          "name": "_retrieveAmount",
          "type": "uint256"
        },
        {
          "internalType": "uint256",
          "name": "_retrievalTime",
          "type": "uint256"
        }
      ],
      "name": "emitAuctionDepositRetrieved",
      "outputs": [],
      "stateMutability": "nonpayable",
      "type": "function"
    },
    {
      "inputs": [
        {
          "internalType": "address",
          "name": "_auction",
          "type": "address"
        },
        {
          "internalType": "address",
          "name": "_nftAddress",
          "type": "address"
        },
        {
          "internalType": "uint256",
          "name": "_tokenId",
          "type": "uint256"
        },
        {
          "internalType": "address",
          "name": "_winner",
          "type": "address"
        },
        {
          "internalType": "address",
          "name": "_seller",
          "type": "address"
        },
        {
          "internalType": "uint256",
          "name": "_paidAmount",
          "type": "uint256"
        },
        {
          "internalType": "uint256",
          "name": "_paidTime",
          "type": "uint256"
        }
      ],
      "name": "emitAuctionFullSettlementPaid",
      "outputs": [],
      "stateMutability": "nonpayable",
      "type": "function"
    },
    {
      "inputs": [
        {
          "internalType": "address",
          "name": "_auction",
          "type": "address"
        },
        {
          "internalType": "address",
          "name": "_seller",
          "type": "address"
        },
        {
          "internalType": "address",
          "name": "_nftAddress",
          "type": "address"
        },
        {
          "internalType": "uint256",
          "name": "_tokenId",
          "type": "uint256"
        },
        {
          "internalType": "address",
          "name": "_winner",
          "type": "address"
        },
        {
          "internalType": "uint256",
          "name": "_winningBid",
          "type": "uint256"
        },
        {
          "internalType": "uint256",
          "name": "_startTime",
          "type": "uint256"
        },
        {
          "internalType": "uint256",
          "name": "_expiryTime",
          "type": "uint256"
        }
      ],
      "name": "emitAuctionPendingPayment",
      "outputs": [],
      "stateMutability": "nonpayable",
      "type": "function"
    },
    {
      "inputs": [
        {
          "internalType": "address",
          "name": "_auction",
          "type": "address"
        },
        {
          "internalType": "address",
          "name": "_seller",
          "type": "address"
        },
        {
          "internalType": "address",
          "name": "_nftAddress",
          "type": "address"
        },
        {
          "internalType": "uint256",
          "name": "_tokenId",
          "type": "uint256"
        },
        {
          "internalType": "uint256",
          "name": "_registerTime",
          "type": "uint256"
        }
      ],
      "name": "emitAuctionRegistered",
      "outputs": [],
      "stateMutability": "nonpayable",
      "type": "function"
    },
    {
      "inputs": [
        {
          "internalType": "address",
          "name": "_auction",
          "type": "address"
        },
        {
          "internalType": "address",
          "name": "_seller",
          "type": "address"
        },
        {
          "internalType": "address",
          "name": "_nftAddress",
          "type": "address"
        },
        {
          "internalType": "uint256",
          "name": "_tokenId",
          "type": "uint256"
        },
        {
          "internalType": "uint256",
          "name": "_depositWei",
          "type": "uint256"
        },
        {
          "internalType": "uint256",
          "name": "_startTime",
          "type": "uint256"
        },
        {
          "internalType": "uint256",
          "name": "_bidEndTime",
          "type": "uint256"
        },
        {
          "internalType": "uint256",
          "name": "_startingBid",
          "type": "uint256"
        }
      ],
      "name": "emitAuctionStartedBidding",
      "outputs": [],
      "stateMutability": "nonpayable",
      "type": "function"
    },
    {
      "inputs": [
        {
          "internalType": "address",
          "name": "_auction",
          "type": "address"
        },
        {
          "internalType": "address",
          "name": "_seller",
          "type": "address"
        },
        {
          "internalType": "address",
          "name": "_nftAddress",
          "type": "address"
        },
        {
          "internalType": "uint256",
          "name": "_tokenId",
          "type": "uint256"
        },
        {
          "internalType": "address",
          "name": "_winner",
          "type": "address"
        },
        {
          "internalType": "uint256",
          "name": "_winningBid",
          "type": "uint256"
        },
        {
          "internalType": "uint256",
          "name": "_platformCharge",
          "type": "uint256"
        },
        {
          "internalType": "uint256",
          "name": "_startTime",
          "type": "uint256"
        },
        {
          "internalType": "uint256",
          "name": "_expiryTime",
          "type": "uint256"
        }
      ],
      "name": "emitAuctionVerifyingWinner",
      "outputs": [],
      "stateMutability": "nonpayable",
      "type": "function"
    },
    {
      "inputs": [
        {
          "internalType": "address",
          "name": "_platformOwner",
          "type": "address"
        },
        {
          "internalType": "address",
          "name": "_payer",
          "type": "address"
        },
        {
          "internalType": "address",
          "name": "_auction",
          "type": "address"
        },
        {
          "internalType": "enum Constants.PlatformEarnings",
          "name": "_earningType",
          "type": "uint8"
        },
        {
          "internalType": "uint256",
          "name": "_time",
          "type": "uint256"
        }
      ],
      "name": "emitPlatformEarnings",
      "outputs": [],
      "stateMutability": "nonpayable",
      "type": "function"
    },
    {
      "inputs": [
        {
          "internalType": "address",
          "name": "_auction",
          "type": "address"
        },
        {
          "internalType": "address",
          "name": "_nftAddress",
          "type": "address"
        },
        {
          "internalType": "uint256",
          "name": "_tokenId",
          "type": "uint256"
        },
        {
          "internalType": "address",
          "name": "_seller",
          "type": "address"
        },
        {
          "internalType": "uint256",
          "name": "_retrieveAmount",
          "type": "uint256"
        },
        {
          "internalType": "uint256",
          "name": "_retrievalTime",
          "type": "uint256"
        }
      ],
      "name": "emitSellerEarningsRetrieved",
      "outputs": [],
      "stateMutability": "nonpayable",
      "type": "function"
    },
    {
      "inputs": [
        {
          "internalType": "address",
          "name": "_auction",
          "type": "address"
        },
        {
          "internalType": "address",
          "name": "_nftAddress",
          "type": "address"
        },
        {
          "internalType": "uint256",
          "name": "_tokenId",
          "type": "uint256"
        },
        {
          "internalType": "address",
          "name": "_winner",
          "type": "address"
        },
        {
          "internalType": "uint256",
          "name": "_refundAmount",
          "type": "uint256"
        },
        {
          "internalType": "uint256",
          "name": "_retrievalTime",
          "type": "uint256"
        }
      ],
      "name": "emitWinnerPaymentRefunded",
      "outputs": [],
      "stateMutability": "nonpayable",
      "type": "function"
    }
  ],
  "transactionHash": "0xe210f2ae6724963d8f3a8d1893329fc7508ecfdbe69f14fcb9592680bf682bff",
  "receipt": {
    "to": null,
    "from": "0xA8C457930129a4825227c12706Ad99b7E4528Ac0",
    "contractAddress": "0xbE1b58B66b0395cDC4A9C582b16DE80fc7a2EC5a",
    "transactionIndex": 4,
    "gasUsed": "1101580",
    "logsBloom": "0x00000000000000000000000000000000000000000000000000000000000000000000000000000000000000000000000000000000000000000000000000000000000000000000000000000000000000000000000000000000000000000000000000000000000000000000000000000000000000000000000000000000000000000000000000000000000000000000000000000000000000000000000000000000000000000000000000000000000000000000000000000000000000000000000000000000000000000000000000000000000000000000000000000000000000000000000000000000000000000000000000000000000000000000000000000000",
    "blockHash": "0x8e218cecf07b47f72eb08a9e45e0a8db28b3da0312f36d7e149b4cd61a84da0e",
    "transactionHash": "0xe210f2ae6724963d8f3a8d1893329fc7508ecfdbe69f14fcb9592680bf682bff",
    "logs": [],
    "blockNumber": 7680280,
    "cumulativeGasUsed": "1629873",
    "status": 1,
    "byzantium": true
  },
  "args": [],
  "numDeployments": 2,
  "solcInputHash": "873df27978f0386f3c0ba3fc13f1d329",
  "metadata": "{\"compiler\":{\"version\":\"0.8.8+commit.dddeac2f\"},\"language\":\"Solidity\",\"output\":{\"abi\":[{\"anonymous\":false,\"inputs\":[{\"indexed\":true,\"internalType\":\"address\",\"name\":\"auction\",\"type\":\"address\"},{\"indexed\":false,\"internalType\":\"address\",\"name\":\"seller\",\"type\":\"address\"},{\"indexed\":false,\"internalType\":\"address\",\"name\":\"nftAddress\",\"type\":\"address\"},{\"indexed\":true,\"internalType\":\"uint256\",\"name\":\"tokenId\",\"type\":\"uint256\"},{\"indexed\":true,\"internalType\":\"address\",\"name\":\"winner\",\"type\":\"address\"},{\"indexed\":false,\"internalType\":\"uint256\",\"name\":\"winningBid\",\"type\":\"uint256\"},{\"indexed\":false,\"internalType\":\"uint256\",\"name\":\"time\",\"type\":\"uint256\"},{\"indexed\":false,\"internalType\":\"bool\",\"name\":\"pass\",\"type\":\"bool\"}],\"name\":\"AuctionAuditResult\",\"type\":\"event\"},{\"anonymous\":false,\"inputs\":[{\"indexed\":true,\"internalType\":\"address\",\"name\":\"auction\",\"type\":\"address\"},{\"indexed\":true,\"internalType\":\"address\",\"name\":\"nftAddress\",\"type\":\"address\"},{\"indexed\":true,\"internalType\":\"uint256\",\"name\":\"tokenId\",\"type\":\"uint256\"},{\"indexed\":false,\"internalType\":\"address\",\"name\":\"bidder\",\"type\":\"address\"},{\"indexed\":false,\"internalType\":\"uint256\",\"name\":\"bidAmount\",\"type\":\"uint256\"},{\"indexed\":false,\"internalType\":\"uint256\",\"name\":\"bidTime\",\"type\":\"uint256\"}],\"name\":\"AuctionBidPlaced\",\"type\":\"event\"},{\"anonymous\":false,\"inputs\":[{\"indexed\":true,\"internalType\":\"address\",\"name\":\"auction\",\"type\":\"address\"},{\"indexed\":false,\"internalType\":\"address\",\"name\":\"seller\",\"type\":\"address\"},{\"indexed\":false,\"internalType\":\"address\",\"name\":\"nftAddress\",\"type\":\"address\"},{\"indexed\":true,\"internalType\":\"uint256\",\"name\":\"tokenId\",\"type\":\"uint256\"},{\"indexed\":false,\"internalType\":\"uint256\",\"name\":\"closeTime\",\"type\":\"uint256\"},{\"indexed\":false,\"internalType\":\"address\",\"name\":\"winner\",\"type\":\"address\"},{\"indexed\":false,\"internalType\":\"uint256\",\"name\":\"winningBid\",\"type\":\"uint256\"},{\"indexed\":true,\"internalType\":\"enum Constants.AuctionEndState\",\"name\":\"endState\",\"type\":\"uint8\"}],\"name\":\"AuctionClosed\",\"type\":\"event\"},{\"anonymous\":false,\"inputs\":[{\"indexed\":true,\"internalType\":\"address\",\"name\":\"auction\",\"type\":\"address\"},{\"indexed\":true,\"internalType\":\"address\",\"name\":\"nftAddress\",\"type\":\"address\"},{\"indexed\":true,\"internalType\":\"uint256\",\"name\":\"tokenId\",\"type\":\"uint256\"},{\"indexed\":false,\"internalType\":\"address\",\"name\":\"bidder\",\"type\":\"address\"},{\"indexed\":false,\"internalType\":\"uint256\",\"name\":\"depositAmount\",\"type\":\"uint256\"},{\"indexed\":false,\"internalType\":\"uint256\",\"name\":\"depositTime\",\"type\":\"uint256\"}],\"name\":\"AuctionDepositPlaced\",\"type\":\"event\"},{\"anonymous\":false,\"inputs\":[{\"indexed\":true,\"internalType\":\"address\",\"name\":\"auction\",\"type\":\"address\"},{\"indexed\":true,\"internalType\":\"address\",\"name\":\"nftAddress\",\"type\":\"address\"},{\"indexed\":true,\"internalType\":\"uint256\",\"name\":\"tokenId\",\"type\":\"uint256\"},{\"indexed\":false,\"internalType\":\"address\",\"name\":\"bidder\",\"type\":\"address\"},{\"indexed\":false,\"internalType\":\"uint256\",\"name\":\"retrieveAmount\",\"type\":\"uint256\"},{\"indexed\":false,\"internalType\":\"uint256\",\"name\":\"retrievalTime\",\"type\":\"uint256\"}],\"name\":\"AuctionDepositRetrieved\",\"type\":\"event\"},{\"anonymous\":false,\"inputs\":[{\"indexed\":true,\"internalType\":\"address\",\"name\":\"auction\",\"type\":\"address\"},{\"indexed\":false,\"internalType\":\"address\",\"name\":\"nftAddress\",\"type\":\"address\"},{\"indexed\":false,\"internalType\":\"uint256\",\"name\":\"tokenId\",\"type\":\"uint256\"},{\"indexed\":true,\"internalType\":\"address\",\"name\":\"winner\",\"type\":\"address\"},{\"indexed\":false,\"internalType\":\"address\",\"name\":\"seller\",\"type\":\"address\"},{\"indexed\":true,\"internalType\":\"uint256\",\"name\":\"paidAmount\",\"type\":\"uint256\"},{\"indexed\":false,\"internalType\":\"uint256\",\"name\":\"paidTime\",\"type\":\"uint256\"}],\"name\":\"AuctionFullSettlementPaid\",\"type\":\"event\"},{\"anonymous\":false,\"inputs\":[{\"indexed\":true,\"internalType\":\"address\",\"name\":\"auction\",\"type\":\"address\"},{\"indexed\":false,\"internalType\":\"address\",\"name\":\"seller\",\"type\":\"address\"},{\"indexed\":false,\"internalType\":\"address\",\"name\":\"nftAddress\",\"type\":\"address\"},{\"indexed\":true,\"internalType\":\"uint256\",\"name\":\"tokenId\",\"type\":\"uint256\"},{\"indexed\":true,\"internalType\":\"address\",\"name\":\"winner\",\"type\":\"address\"},{\"indexed\":false,\"internalType\":\"uint256\",\"name\":\"winningBid\",\"type\":\"uint256\"},{\"indexed\":false,\"internalType\":\"uint256\",\"name\":\"startTime\",\"type\":\"uint256\"},{\"indexed\":false,\"internalType\":\"uint256\",\"name\":\"endTime\",\"type\":\"uint256\"}],\"name\":\"AuctionPendingPayment\",\"type\":\"event\"},{\"anonymous\":false,\"inputs\":[{\"indexed\":true,\"internalType\":\"address\",\"name\":\"auction\",\"type\":\"address\"},{\"indexed\":false,\"internalType\":\"address\",\"name\":\"seller\",\"type\":\"address\"},{\"indexed\":true,\"internalType\":\"address\",\"name\":\"nftAddress\",\"type\":\"address\"},{\"indexed\":true,\"internalType\":\"uint256\",\"name\":\"tokenId\",\"type\":\"uint256\"},{\"indexed\":false,\"internalType\":\"uint256\",\"name\":\"registerTime\",\"type\":\"uint256\"}],\"name\":\"AuctionRegistered\",\"type\":\"event\"},{\"anonymous\":false,\"inputs\":[{\"indexed\":true,\"internalType\":\"address\",\"name\":\"auction\",\"type\":\"address\"},{\"indexed\":false,\"internalType\":\"address\",\"name\":\"seller\",\"type\":\"address\"},{\"indexed\":true,\"internalType\":\"address\",\"name\":\"nftAddress\",\"type\":\"address\"},{\"indexed\":true,\"internalType\":\"uint256\",\"name\":\"tokenId\",\"type\":\"uint256\"},{\"indexed\":false,\"internalType\":\"uint256\",\"name\":\"depositWei\",\"type\":\"uint256\"},{\"indexed\":false,\"internalType\":\"uint256\",\"name\":\"bidStartTime\",\"type\":\"uint256\"},{\"indexed\":false,\"internalType\":\"uint256\",\"name\":\"bidEndTime\",\"type\":\"uint256\"},{\"indexed\":false,\"internalType\":\"uint256\",\"name\":\"startingBid\",\"type\":\"uint256\"}],\"name\":\"AuctionStartedBidding\",\"type\":\"event\"},{\"anonymous\":false,\"inputs\":[{\"indexed\":true,\"internalType\":\"address\",\"name\":\"auction\",\"type\":\"address\"},{\"indexed\":false,\"internalType\":\"address\",\"name\":\"seller\",\"type\":\"address\"},{\"indexed\":false,\"internalType\":\"address\",\"name\":\"nftAddress\",\"type\":\"address\"},{\"indexed\":true,\"internalType\":\"uint256\",\"name\":\"tokenId\",\"type\":\"uint256\"},{\"indexed\":true,\"internalType\":\"address\",\"name\":\"winner\",\"type\":\"address\"},{\"indexed\":false,\"internalType\":\"uint256\",\"name\":\"winningBid\",\"type\":\"uint256\"},{\"indexed\":false,\"internalType\":\"uint256\",\"name\":\"platformCharge\",\"type\":\"uint256\"},{\"indexed\":false,\"internalType\":\"uint256\",\"name\":\"startTime\",\"type\":\"uint256\"},{\"indexed\":false,\"internalType\":\"uint256\",\"name\":\"endTime\",\"type\":\"uint256\"}],\"name\":\"AuctionVerifyingWinner\",\"type\":\"event\"},{\"anonymous\":false,\"inputs\":[{\"indexed\":true,\"internalType\":\"address\",\"name\":\"platformOwner\",\"type\":\"address\"},{\"indexed\":false,\"internalType\":\"address\",\"name\":\"payer\",\"type\":\"address\"},{\"indexed\":true,\"internalType\":\"address\",\"name\":\"auction\",\"type\":\"address\"},{\"indexed\":false,\"internalType\":\"enum Constants.PlatformEarnings\",\"name\":\"earningType\",\"type\":\"uint8\"},{\"indexed\":false,\"internalType\":\"uint256\",\"name\":\"time\",\"type\":\"uint256\"}],\"name\":\"PlatformEarnings\",\"type\":\"event\"},{\"anonymous\":false,\"inputs\":[{\"indexed\":true,\"internalType\":\"address\",\"name\":\"auction\",\"type\":\"address\"},{\"indexed\":false,\"internalType\":\"address\",\"name\":\"nftAddress\",\"type\":\"address\"},{\"indexed\":false,\"internalType\":\"uint256\",\"name\":\"tokenId\",\"type\":\"uint256\"},{\"indexed\":true,\"internalType\":\"address\",\"name\":\"seller\",\"type\":\"address\"},{\"indexed\":true,\"internalType\":\"uint256\",\"name\":\"retrieveAmount\",\"type\":\"uint256\"},{\"indexed\":false,\"internalType\":\"uint256\",\"name\":\"retrievalTime\",\"type\":\"uint256\"}],\"name\":\"SellerEarningsRetrieved\",\"type\":\"event\"},{\"anonymous\":false,\"inputs\":[{\"indexed\":true,\"internalType\":\"address\",\"name\":\"auction\",\"type\":\"address\"},{\"indexed\":false,\"internalType\":\"address\",\"name\":\"nftAddress\",\"type\":\"address\"},{\"indexed\":false,\"internalType\":\"uint256\",\"name\":\"tokenId\",\"type\":\"uint256\"},{\"indexed\":false,\"internalType\":\"address\",\"name\":\"winner\",\"type\":\"address\"},{\"indexed\":true,\"internalType\":\"uint256\",\"name\":\"refundAmount\",\"type\":\"uint256\"},{\"indexed\":false,\"internalType\":\"uint256\",\"name\":\"retrievalTime\",\"type\":\"uint256\"}],\"name\":\"winnerPaymentRefunded\",\"type\":\"event\"},{\"inputs\":[{\"internalType\":\"address\",\"name\":\"_auction\",\"type\":\"address\"},{\"internalType\":\"address\",\"name\":\"_seller\",\"type\":\"address\"},{\"internalType\":\"address\",\"name\":\"_nftAddress\",\"type\":\"address\"},{\"internalType\":\"uint256\",\"name\":\"_tokenId\",\"type\":\"uint256\"},{\"internalType\":\"address\",\"name\":\"_winner\",\"type\":\"address\"},{\"internalType\":\"uint256\",\"name\":\"_winningBid\",\"type\":\"uint256\"},{\"internalType\":\"uint256\",\"name\":\"_time\",\"type\":\"uint256\"},{\"internalType\":\"bool\",\"name\":\"_pass\",\"type\":\"bool\"}],\"name\":\"emitAuctionAuditResult\",\"outputs\":[],\"stateMutability\":\"nonpayable\",\"type\":\"function\"},{\"inputs\":[{\"internalType\":\"address\",\"name\":\"_auction\",\"type\":\"address\"},{\"internalType\":\"address\",\"name\":\"_nftAddress\",\"type\":\"address\"},{\"internalType\":\"uint256\",\"name\":\"_tokenId\",\"type\":\"uint256\"},{\"internalType\":\"address\",\"name\":\"_bidder\",\"type\":\"address\"},{\"internalType\":\"uint256\",\"name\":\"_bidAmount\",\"type\":\"uint256\"},{\"internalType\":\"uint256\",\"name\":\"_bidTime\",\"type\":\"uint256\"}],\"name\":\"emitAuctionBidPlaced\",\"outputs\":[],\"stateMutability\":\"nonpayable\",\"type\":\"function\"},{\"inputs\":[{\"internalType\":\"address\",\"name\":\"_auction\",\"type\":\"address\"},{\"internalType\":\"address\",\"name\":\"_seller\",\"type\":\"address\"},{\"internalType\":\"address\",\"name\":\"_nftAddress\",\"type\":\"address\"},{\"internalType\":\"uint256\",\"name\":\"_tokenId\",\"type\":\"uint256\"},{\"internalType\":\"uint256\",\"name\":\"_closeTime\",\"type\":\"uint256\"},{\"internalType\":\"address\",\"name\":\"_winner\",\"type\":\"address\"},{\"internalType\":\"uint256\",\"name\":\"_winningBid\",\"type\":\"uint256\"},{\"internalType\":\"enum Constants.AuctionEndState\",\"name\":\"_endState\",\"type\":\"uint8\"}],\"name\":\"emitAuctionClosed\",\"outputs\":[],\"stateMutability\":\"nonpayable\",\"type\":\"function\"},{\"inputs\":[{\"internalType\":\"address\",\"name\":\"_auction\",\"type\":\"address\"},{\"internalType\":\"address\",\"name\":\"_nftAddress\",\"type\":\"address\"},{\"internalType\":\"uint256\",\"name\":\"_tokenId\",\"type\":\"uint256\"},{\"internalType\":\"address\",\"name\":\"_bidder\",\"type\":\"address\"},{\"internalType\":\"uint256\",\"name\":\"_depositAmount\",\"type\":\"uint256\"},{\"internalType\":\"uint256\",\"name\":\"_depositTime\",\"type\":\"uint256\"}],\"name\":\"emitAuctionDepositPlaced\",\"outputs\":[],\"stateMutability\":\"nonpayable\",\"type\":\"function\"},{\"inputs\":[{\"internalType\":\"address\",\"name\":\"_auction\",\"type\":\"address\"},{\"internalType\":\"address\",\"name\":\"_nftAddress\",\"type\":\"address\"},{\"internalType\":\"uint256\",\"name\":\"_tokenId\",\"type\":\"uint256\"},{\"internalType\":\"address\",\"name\":\"_bidder\",\"type\":\"address\"},{\"internalType\":\"uint256\",\"name\":\"_retrieveAmount\",\"type\":\"uint256\"},{\"internalType\":\"uint256\",\"name\":\"_retrievalTime\",\"type\":\"uint256\"}],\"name\":\"emitAuctionDepositRetrieved\",\"outputs\":[],\"stateMutability\":\"nonpayable\",\"type\":\"function\"},{\"inputs\":[{\"internalType\":\"address\",\"name\":\"_auction\",\"type\":\"address\"},{\"internalType\":\"address\",\"name\":\"_nftAddress\",\"type\":\"address\"},{\"internalType\":\"uint256\",\"name\":\"_tokenId\",\"type\":\"uint256\"},{\"internalType\":\"address\",\"name\":\"_winner\",\"type\":\"address\"},{\"internalType\":\"address\",\"name\":\"_seller\",\"type\":\"address\"},{\"internalType\":\"uint256\",\"name\":\"_paidAmount\",\"type\":\"uint256\"},{\"internalType\":\"uint256\",\"name\":\"_paidTime\",\"type\":\"uint256\"}],\"name\":\"emitAuctionFullSettlementPaid\",\"outputs\":[],\"stateMutability\":\"nonpayable\",\"type\":\"function\"},{\"inputs\":[{\"internalType\":\"address\",\"name\":\"_auction\",\"type\":\"address\"},{\"internalType\":\"address\",\"name\":\"_seller\",\"type\":\"address\"},{\"internalType\":\"address\",\"name\":\"_nftAddress\",\"type\":\"address\"},{\"internalType\":\"uint256\",\"name\":\"_tokenId\",\"type\":\"uint256\"},{\"internalType\":\"address\",\"name\":\"_winner\",\"type\":\"address\"},{\"internalType\":\"uint256\",\"name\":\"_winningBid\",\"type\":\"uint256\"},{\"internalType\":\"uint256\",\"name\":\"_startTime\",\"type\":\"uint256\"},{\"internalType\":\"uint256\",\"name\":\"_expiryTime\",\"type\":\"uint256\"}],\"name\":\"emitAuctionPendingPayment\",\"outputs\":[],\"stateMutability\":\"nonpayable\",\"type\":\"function\"},{\"inputs\":[{\"internalType\":\"address\",\"name\":\"_auction\",\"type\":\"address\"},{\"internalType\":\"address\",\"name\":\"_seller\",\"type\":\"address\"},{\"internalType\":\"address\",\"name\":\"_nftAddress\",\"type\":\"address\"},{\"internalType\":\"uint256\",\"name\":\"_tokenId\",\"type\":\"uint256\"},{\"internalType\":\"uint256\",\"name\":\"_registerTime\",\"type\":\"uint256\"}],\"name\":\"emitAuctionRegistered\",\"outputs\":[],\"stateMutability\":\"nonpayable\",\"type\":\"function\"},{\"inputs\":[{\"internalType\":\"address\",\"name\":\"_auction\",\"type\":\"address\"},{\"internalType\":\"address\",\"name\":\"_seller\",\"type\":\"address\"},{\"internalType\":\"address\",\"name\":\"_nftAddress\",\"type\":\"address\"},{\"internalType\":\"uint256\",\"name\":\"_tokenId\",\"type\":\"uint256\"},{\"internalType\":\"uint256\",\"name\":\"_depositWei\",\"type\":\"uint256\"},{\"internalType\":\"uint256\",\"name\":\"_startTime\",\"type\":\"uint256\"},{\"internalType\":\"uint256\",\"name\":\"_bidEndTime\",\"type\":\"uint256\"},{\"internalType\":\"uint256\",\"name\":\"_startingBid\",\"type\":\"uint256\"}],\"name\":\"emitAuctionStartedBidding\",\"outputs\":[],\"stateMutability\":\"nonpayable\",\"type\":\"function\"},{\"inputs\":[{\"internalType\":\"address\",\"name\":\"_auction\",\"type\":\"address\"},{\"internalType\":\"address\",\"name\":\"_seller\",\"type\":\"address\"},{\"internalType\":\"address\",\"name\":\"_nftAddress\",\"type\":\"address\"},{\"internalType\":\"uint256\",\"name\":\"_tokenId\",\"type\":\"uint256\"},{\"internalType\":\"address\",\"name\":\"_winner\",\"type\":\"address\"},{\"internalType\":\"uint256\",\"name\":\"_winningBid\",\"type\":\"uint256\"},{\"internalType\":\"uint256\",\"name\":\"_platformCharge\",\"type\":\"uint256\"},{\"internalType\":\"uint256\",\"name\":\"_startTime\",\"type\":\"uint256\"},{\"internalType\":\"uint256\",\"name\":\"_expiryTime\",\"type\":\"uint256\"}],\"name\":\"emitAuctionVerifyingWinner\",\"outputs\":[],\"stateMutability\":\"nonpayable\",\"type\":\"function\"},{\"inputs\":[{\"internalType\":\"address\",\"name\":\"_platformOwner\",\"type\":\"address\"},{\"internalType\":\"address\",\"name\":\"_payer\",\"type\":\"address\"},{\"internalType\":\"address\",\"name\":\"_auction\",\"type\":\"address\"},{\"internalType\":\"enum Constants.PlatformEarnings\",\"name\":\"_earningType\",\"type\":\"uint8\"},{\"internalType\":\"uint256\",\"name\":\"_time\",\"type\":\"uint256\"}],\"name\":\"emitPlatformEarnings\",\"outputs\":[],\"stateMutability\":\"nonpayable\",\"type\":\"function\"},{\"inputs\":[{\"internalType\":\"address\",\"name\":\"_auction\",\"type\":\"address\"},{\"internalType\":\"address\",\"name\":\"_nftAddress\",\"type\":\"address\"},{\"internalType\":\"uint256\",\"name\":\"_tokenId\",\"type\":\"uint256\"},{\"internalType\":\"address\",\"name\":\"_seller\",\"type\":\"address\"},{\"internalType\":\"uint256\",\"name\":\"_retrieveAmount\",\"type\":\"uint256\"},{\"internalType\":\"uint256\",\"name\":\"_retrievalTime\",\"type\":\"uint256\"}],\"name\":\"emitSellerEarningsRetrieved\",\"outputs\":[],\"stateMutability\":\"nonpayable\",\"type\":\"function\"},{\"inputs\":[{\"internalType\":\"address\",\"name\":\"_auction\",\"type\":\"address\"},{\"internalType\":\"address\",\"name\":\"_nftAddress\",\"type\":\"address\"},{\"internalType\":\"uint256\",\"name\":\"_tokenId\",\"type\":\"uint256\"},{\"internalType\":\"address\",\"name\":\"_winner\",\"type\":\"address\"},{\"internalType\":\"uint256\",\"name\":\"_refundAmount\",\"type\":\"uint256\"},{\"internalType\":\"uint256\",\"name\":\"_retrievalTime\",\"type\":\"uint256\"}],\"name\":\"emitWinnerPaymentRefunded\",\"outputs\":[],\"stateMutability\":\"nonpayable\",\"type\":\"function\"}],\"devdoc\":{\"kind\":\"dev\",\"methods\":{},\"version\":1},\"userdoc\":{\"kind\":\"user\",\"methods\":{},\"version\":1}},\"settings\":{\"compilationTarget\":{\"contracts/AuctionContracts.sol\":\"EventEmitter\"},\"evmVersion\":\"london\",\"libraries\":{},\"metadata\":{\"bytecodeHash\":\"ipfs\",\"useLiteralContent\":true},\"optimizer\":{\"details\":{\"constantOptimizer\":true,\"cse\":true,\"deduplicate\":true,\"inliner\":true,\"jumpdestRemover\":true,\"orderLiterals\":true,\"peephole\":true,\"yul\":false},\"runs\":200},\"remappings\":[]},\"sources\":{\"@chainlink/contracts/src/v0.8/KeeperBase.sol\":{\"content\":\"// SPDX-License-Identifier: MIT\\npragma solidity ^0.8.0;\\n\\ncontract KeeperBase {\\n  error OnlySimulatedBackend();\\n\\n  /**\\n   * @notice method that allows it to be simulated via eth_call by checking that\\n   * the sender is the zero address.\\n   */\\n  function preventExecution() internal view {\\n    if (tx.origin != address(0)) {\\n      revert OnlySimulatedBackend();\\n    }\\n  }\\n\\n  /**\\n   * @notice modifier that allows it to be simulated via eth_call by checking\\n   * that the sender is the zero address.\\n   */\\n  modifier cannotExecute() {\\n    preventExecution();\\n    _;\\n  }\\n}\\n\",\"keccak256\":\"0x5dc972fdf3a524312e68ef6d2e58bcdaf965d08d9415aefa289207350c2bc85a\",\"license\":\"MIT\"},\"@chainlink/contracts/src/v0.8/KeeperCompatible.sol\":{\"content\":\"// SPDX-License-Identifier: MIT\\npragma solidity ^0.8.0;\\n\\nimport \\\"./KeeperBase.sol\\\";\\nimport \\\"./interfaces/KeeperCompatibleInterface.sol\\\";\\n\\nabstract contract KeeperCompatible is KeeperBase, KeeperCompatibleInterface {}\\n\",\"keccak256\":\"0xfdb84fea1ee213662ae66b95d4f620be73b7af5ede58be3d330b222b9b566d95\",\"license\":\"MIT\"},\"@chainlink/contracts/src/v0.8/interfaces/AggregatorV3Interface.sol\":{\"content\":\"// SPDX-License-Identifier: MIT\\npragma solidity ^0.8.0;\\n\\ninterface AggregatorV3Interface {\\n  function decimals() external view returns (uint8);\\n\\n  function description() external view returns (string memory);\\n\\n  function version() external view returns (uint256);\\n\\n  // getRoundData and latestRoundData should both raise \\\"No data present\\\"\\n  // if they do not have data to report, instead of returning unset values\\n  // which could be misinterpreted as actual reported values.\\n  function getRoundData(uint80 _roundId)\\n    external\\n    view\\n    returns (\\n      uint80 roundId,\\n      int256 answer,\\n      uint256 startedAt,\\n      uint256 updatedAt,\\n      uint80 answeredInRound\\n    );\\n\\n  function latestRoundData()\\n    external\\n    view\\n    returns (\\n      uint80 roundId,\\n      int256 answer,\\n      uint256 startedAt,\\n      uint256 updatedAt,\\n      uint80 answeredInRound\\n    );\\n}\\n\",\"keccak256\":\"0xf2b6c9adb3552254df1445b73563cf014434ff5e78663e9b961b6c059506ceb5\",\"license\":\"MIT\"},\"@chainlink/contracts/src/v0.8/interfaces/KeeperCompatibleInterface.sol\":{\"content\":\"// SPDX-License-Identifier: MIT\\npragma solidity ^0.8.0;\\n\\ninterface KeeperCompatibleInterface {\\n  /**\\n   * @notice method that is simulated by the keepers to see if any work actually\\n   * needs to be performed. This method does does not actually need to be\\n   * executable, and since it is only ever simulated it can consume lots of gas.\\n   * @dev To ensure that it is never called, you may want to add the\\n   * cannotExecute modifier from KeeperBase to your implementation of this\\n   * method.\\n   * @param checkData specified in the upkeep registration so it is always the\\n   * same for a registered upkeep. This can easily be broken down into specific\\n   * arguments using `abi.decode`, so multiple upkeeps can be registered on the\\n   * same contract and easily differentiated by the contract.\\n   * @return upkeepNeeded boolean to indicate whether the keeper should call\\n   * performUpkeep or not.\\n   * @return performData bytes that the keeper should call performUpkeep with, if\\n   * upkeep is needed. If you would like to encode data to decode later, try\\n   * `abi.encode`.\\n   */\\n  function checkUpkeep(bytes calldata checkData) external returns (bool upkeepNeeded, bytes memory performData);\\n\\n  /**\\n   * @notice method that is actually executed by the keepers, via the registry.\\n   * The data returned by the checkUpkeep simulation will be passed into\\n   * this method to actually be executed.\\n   * @dev The input to this method should not be trusted, and the caller of the\\n   * method should not even be restricted to any single registry. Anyone should\\n   * be able call it, and the input should be validated, there is no guarantee\\n   * that the data passed in is the performData returned from checkUpkeep. This\\n   * could happen due to malicious keepers, racing keepers, or simply a state\\n   * change while the performUpkeep transaction is waiting for confirmation.\\n   * Always validate the data passed in.\\n   * @param performData is the data which was passed back from the checkData\\n   * simulation. If it is encoded, it can easily be decoded into other types by\\n   * calling `abi.decode`. This data should not be trusted, and should be\\n   * validated against the contract's current state.\\n   */\\n  function performUpkeep(bytes calldata performData) external;\\n}\\n\",\"keccak256\":\"0xb6577cda6b731b655aebcb6e3c24f8658d3f4c5eda07200622d07d4570af33ea\",\"license\":\"MIT\"},\"contracts/AuctionContracts.sol\":{\"content\":\"// SPDX-License-Identifier: MIT\\npragma solidity ^0.8.8;\\n\\nimport \\\"@chainlink/contracts/src/v0.8/interfaces/AggregatorV3Interface.sol\\\";\\nimport \\\"@chainlink/contracts/src/v0.8/KeeperCompatible.sol\\\";\\nimport \\\"../libraries/AuctionUtility.sol\\\";\\n\\nerror AuctionRegistry_RestrictedOwnerAccess();\\nerror AuctionRegistry_RestrictedContractFactoryAccess();\\nerror AuctionRegistry__RestrictedManagerAccess();\\nerror AuctionRegistry__AuctionOngoing();\\n\\nerror Auction_RestrictedSellerAccess();\\nerror Auction_NotInPendingPaymentState();\\nerror Auction_RestrictedWinnerPaymentAccess();\\nerror Auction_SelfBiddingIsNotAllowed();\\nerror Auction_NoProceeds();\\nerror Auction_UnauthorizedAccess();\\n\\nerror ContractFactory__RestrictedManagerAccess();\\nerror ContractFactory_RestrictedOwnerAccess();\\n\\n/*\\n1. Seller can register a new vehicle by minting a vehicle NFT\\n2. Seller can host an auction for vehicles NFT that they own by creating a new BiddingHost contract\\n3. BiddingHost can call HAP to emit events \\n    to record each bid, extend bid end time, end bid, and record pending payments\\n4. Chainlink Keeper is needed for automated end bid + refund deposit, lock contract + send deposit to HAP owner\\n5. Chainlink Oracle is needed to fetch the latest usd -> eth rate\\n*/\\ncontract ContractFactory {\\n    address public immutable owner;\\n    address public auctionManagerAddress;\\n    address public auctionRegistryAddress;\\n    AuctionManager private auctionManager;\\n    AuctionRegistry private auctionRegistry;\\n\\n    constructor(address _auctionRegistryAddress) {\\n        owner = msg.sender;\\n        auctionRegistryAddress = _auctionRegistryAddress;\\n        auctionRegistry = AuctionRegistry(_auctionRegistryAddress);\\n    }\\n\\n    modifier onlyOwner() {\\n        if (msg.sender != owner) {\\n            revert ContractFactory_RestrictedOwnerAccess();\\n        }\\n        _;\\n    }\\n\\n    modifier onlyAuctionManager() {\\n        if (msg.sender != auctionManagerAddress) {\\n            revert ContractFactory__RestrictedManagerAccess();\\n        }\\n        _;\\n    }\\n\\n    function getContractType() public pure returns (Constants.ContractType) {\\n        return Constants.ContractType.CONTRACT_FACTORY;\\n    }\\n\\n    function setAuctionManagerAddress(address _auctionManagerAddress)\\n        public\\n        onlyOwner\\n    {\\n        auctionManagerAddress = _auctionManagerAddress;\\n        auctionManager = AuctionManager(auctionManagerAddress);\\n    }\\n\\n    function createAuction(\\n        address _seller,\\n        address _nftAddress,\\n        uint256 _tokenId,\\n        address _eventEmitterAddress,\\n        address _auctionKeeperAddress\\n    ) public onlyAuctionManager {\\n        // call AuctionRegistry, register auction\\n        // create Auction contract\\n        Auction newAuctionInstance = new Auction(\\n            owner,\\n            _seller,\\n            auctionManagerAddress,\\n            _eventEmitterAddress,\\n            _auctionKeeperAddress,\\n            _nftAddress,\\n            _tokenId\\n        );\\n\\n        auctionRegistry.registerAuction(\\n            _nftAddress,\\n            _tokenId,\\n            address(newAuctionInstance)\\n        );\\n    }\\n}\\n\\ncontract EventEmitter {\\n    modifier onlyAuction(address _senderAddress) {\\n        require(\\n            (AuctionUtility.getContractType(_senderAddress) ==\\n                Constants.ContractType.AUCTION),\\n            \\\"eventEmit can only be called by Auction\\\"\\n        );\\n        _;\\n    }\\n\\n    event AuctionRegistered(\\n        address indexed auction,\\n        address seller,\\n        address indexed nftAddress,\\n        uint256 indexed tokenId,\\n        uint256 registerTime\\n    );\\n\\n    event AuctionStartedBidding(\\n        address indexed auction,\\n        address seller,\\n        address indexed nftAddress,\\n        uint256 indexed tokenId,\\n        uint256 depositWei,\\n        uint256 bidStartTime,\\n        uint256 bidEndTime,\\n        uint256 startingBid\\n    );\\n\\n    event AuctionVerifyingWinner(\\n        address indexed auction,\\n        address seller,\\n        address nftAddress,\\n        uint256 indexed tokenId,\\n        address indexed winner,\\n        uint256 winningBid,\\n        uint256 platformCharge,\\n        uint256 startTime,\\n        uint256 endTime\\n    );\\n\\n    event AuctionPendingPayment(\\n        address indexed auction,\\n        address seller,\\n        address nftAddress,\\n        uint256 indexed tokenId,\\n        address indexed winner,\\n        uint256 winningBid,\\n        uint256 startTime,\\n        uint256 endTime\\n    );\\n\\n    event AuctionAuditResult(\\n        address indexed auction,\\n        address seller,\\n        address nftAddress,\\n        uint256 indexed tokenId,\\n        address indexed winner,\\n        uint256 winningBid,\\n        uint256 time,\\n        bool pass\\n    );\\n\\n    // if winner did not pay, in the event listener, change the deposit placed event record (boolean winnerWithdrawal to false)\\n    event AuctionClosed(\\n        address indexed auction,\\n        address seller,\\n        address nftAddress,\\n        uint256 indexed tokenId,\\n        uint256 closeTime,\\n        address winner,\\n        uint256 winningBid,\\n        Constants.AuctionEndState indexed endState\\n    );\\n\\n    event AuctionDepositPlaced(\\n        address indexed auction,\\n        address indexed nftAddress,\\n        uint256 indexed tokenId,\\n        address bidder,\\n        uint256 depositAmount,\\n        uint256 depositTime\\n    );\\n\\n    event AuctionDepositRetrieved(\\n        address indexed auction,\\n        address indexed nftAddress,\\n        uint256 indexed tokenId,\\n        address bidder,\\n        uint256 retrieveAmount,\\n        uint256 retrievalTime\\n    );\\n\\n    event AuctionBidPlaced(\\n        address indexed auction,\\n        address indexed nftAddress,\\n        uint256 indexed tokenId,\\n        address bidder,\\n        uint256 bidAmount,\\n        uint256 bidTime\\n    );\\n\\n    event AuctionFullSettlementPaid(\\n        address indexed auction,\\n        address nftAddress,\\n        uint256 tokenId,\\n        address indexed winner,\\n        address seller,\\n        uint256 indexed paidAmount,\\n        uint256 paidTime\\n    );\\n\\n    event SellerEarningsRetrieved(\\n        address indexed auction,\\n        address nftAddress,\\n        uint256 tokenId,\\n        address indexed seller,\\n        uint256 indexed retrieveAmount,\\n        uint256 retrievalTime\\n    );\\n\\n    event winnerPaymentRefunded(\\n        address indexed auction,\\n        address nftAddress,\\n        uint256 tokenId,\\n        address winner,\\n        uint256 indexed refundAmount,\\n        uint256 retrievalTime\\n    );\\n\\n    event PlatformEarnings(\\n        address indexed platformOwner,\\n        address payer,\\n        address indexed auction,\\n        Constants.PlatformEarnings earningType,\\n        uint256 time\\n    );\\n\\n    function emitAuctionRegistered(\\n        address _auction,\\n        address _seller,\\n        address _nftAddress,\\n        uint256 _tokenId,\\n        uint256 _registerTime\\n    ) public {\\n        emit AuctionRegistered(\\n            _auction,\\n            _seller,\\n            _nftAddress,\\n            _tokenId,\\n            _registerTime\\n        );\\n    }\\n\\n    function emitAuctionStartedBidding(\\n        address _auction,\\n        address _seller,\\n        address _nftAddress,\\n        uint256 _tokenId,\\n        uint256 _depositWei,\\n        uint256 _startTime,\\n        uint256 _bidEndTime,\\n        uint256 _startingBid\\n    ) public onlyAuction(msg.sender) {\\n        emit AuctionStartedBidding(\\n            _auction,\\n            _seller,\\n            _nftAddress,\\n            _tokenId,\\n            _depositWei,\\n            _startTime,\\n            _bidEndTime,\\n            _startingBid\\n        );\\n    }\\n\\n    function emitAuctionVerifyingWinner(\\n        address _auction,\\n        address _seller,\\n        address _nftAddress,\\n        uint256 _tokenId,\\n        address _winner,\\n        uint256 _winningBid,\\n        uint256 _platformCharge,\\n        uint256 _startTime,\\n        uint256 _expiryTime\\n    ) public onlyAuction(msg.sender) {\\n        emit AuctionVerifyingWinner(\\n            _auction,\\n            _seller,\\n            _nftAddress,\\n            _tokenId,\\n            _winner,\\n            _winningBid,\\n            _platformCharge,\\n            _startTime,\\n            _expiryTime\\n        );\\n    }\\n\\n    function emitAuctionPendingPayment(\\n        address _auction,\\n        address _seller,\\n        address _nftAddress,\\n        uint256 _tokenId,\\n        address _winner,\\n        uint256 _winningBid,\\n        uint256 _startTime,\\n        uint256 _expiryTime\\n    ) public onlyAuction(msg.sender) {\\n        emit AuctionPendingPayment(\\n            _auction,\\n            _seller,\\n            _nftAddress,\\n            _tokenId,\\n            _winner,\\n            _winningBid,\\n            _startTime,\\n            _expiryTime\\n        );\\n    }\\n\\n    function emitAuctionAuditResult(\\n        address _auction,\\n        address _seller,\\n        address _nftAddress,\\n        uint256 _tokenId,\\n        address _winner,\\n        uint256 _winningBid,\\n        uint256 _time,\\n        bool _pass\\n    ) public onlyAuction(msg.sender) {\\n        emit AuctionAuditResult(\\n            _auction,\\n            _seller,\\n            _nftAddress,\\n            _tokenId,\\n            _winner,\\n            _winningBid,\\n            _time,\\n            _pass\\n        );\\n    }\\n\\n    function emitAuctionClosed(\\n        address _auction,\\n        address _seller,\\n        address _nftAddress,\\n        uint256 _tokenId,\\n        uint256 _closeTime,\\n        address _winner,\\n        uint256 _winningBid,\\n        Constants.AuctionEndState _endState\\n    ) public onlyAuction(msg.sender) {\\n        emit AuctionClosed(\\n            _auction,\\n            _seller,\\n            _nftAddress,\\n            _tokenId,\\n            _closeTime,\\n            _winner,\\n            _winningBid,\\n            _endState\\n        );\\n    }\\n\\n    function emitAuctionDepositPlaced(\\n        address _auction,\\n        address _nftAddress,\\n        uint256 _tokenId,\\n        address _bidder,\\n        uint256 _depositAmount,\\n        uint256 _depositTime\\n    ) public onlyAuction(msg.sender) {\\n        emit AuctionDepositPlaced(\\n            _auction,\\n            _nftAddress,\\n            _tokenId,\\n            _bidder,\\n            _depositAmount,\\n            _depositTime\\n        );\\n    }\\n\\n    function emitAuctionBidPlaced(\\n        address _auction,\\n        address _nftAddress,\\n        uint256 _tokenId,\\n        address _bidder,\\n        uint256 _bidAmount,\\n        uint256 _bidTime\\n    ) public onlyAuction(msg.sender) {\\n        emit AuctionBidPlaced(\\n            _auction,\\n            _nftAddress,\\n            _tokenId,\\n            _bidder,\\n            _bidAmount,\\n            _bidTime\\n        );\\n    }\\n\\n    function emitAuctionFullSettlementPaid(\\n        address _auction,\\n        address _nftAddress,\\n        uint256 _tokenId,\\n        address _winner,\\n        address _seller,\\n        uint256 _paidAmount,\\n        uint256 _paidTime\\n    ) public onlyAuction(msg.sender) {\\n        emit AuctionFullSettlementPaid(\\n            _auction,\\n            _nftAddress,\\n            _tokenId,\\n            _winner,\\n            _seller,\\n            _paidAmount,\\n            _paidTime\\n        );\\n    }\\n\\n    function emitAuctionDepositRetrieved(\\n        address _auction,\\n        address _nftAddress,\\n        uint256 _tokenId,\\n        address _bidder,\\n        uint256 _retrieveAmount,\\n        uint256 _retrievalTime\\n    ) public onlyAuction(msg.sender) {\\n        emit AuctionDepositRetrieved(\\n            _auction,\\n            _nftAddress,\\n            _tokenId,\\n            _bidder,\\n            _retrieveAmount,\\n            _retrievalTime\\n        );\\n    }\\n\\n    function emitSellerEarningsRetrieved(\\n        address _auction,\\n        address _nftAddress,\\n        uint256 _tokenId,\\n        address _seller,\\n        uint256 _retrieveAmount,\\n        uint256 _retrievalTime\\n    ) public onlyAuction(msg.sender) {\\n        emit SellerEarningsRetrieved(\\n            _auction,\\n            _nftAddress,\\n            _tokenId,\\n            _seller,\\n            _retrieveAmount,\\n            _retrievalTime\\n        );\\n    }\\n\\n    function emitWinnerPaymentRefunded(\\n        address _auction,\\n        address _nftAddress,\\n        uint256 _tokenId,\\n        address _winner,\\n        uint256 _refundAmount,\\n        uint256 _retrievalTime\\n    ) public onlyAuction(msg.sender) {\\n        emit winnerPaymentRefunded(\\n            _auction,\\n            _nftAddress,\\n            _tokenId,\\n            _winner,\\n            _refundAmount,\\n            _retrievalTime\\n        );\\n    }\\n\\n    function emitPlatformEarnings(\\n        address _platformOwner,\\n        address _payer,\\n        address _auction,\\n        Constants.PlatformEarnings _earningType,\\n        uint256 _time\\n    ) public onlyAuction(msg.sender) {\\n        emit PlatformEarnings(\\n            _platformOwner,\\n            _payer,\\n            _auction,\\n            _earningType,\\n            _time\\n        );\\n    }\\n}\\n\\ncontract AuctionRegistry {\\n    address public immutable owner;\\n    address public auctionManagerAddress;\\n    AuctionManager private auctionManager;\\n\\n    mapping(address => mapping(uint256 => address)) public auctionListings;\\n\\n    constructor() {\\n        owner = msg.sender;\\n    }\\n\\n    modifier onlyOwner() {\\n        if (msg.sender != owner) {\\n            revert AuctionRegistry_RestrictedOwnerAccess();\\n        }\\n        _;\\n    }\\n\\n    modifier onlyAuctionManager() {\\n        if (msg.sender != auctionManagerAddress) {\\n            revert AuctionRegistry__RestrictedManagerAccess();\\n        }\\n        _;\\n    }\\n\\n    modifier onlyContractFactory() {\\n        if (\\n            AuctionUtility.getContractType(msg.sender) !=\\n            Constants.ContractType.CONTRACT_FACTORY\\n        ) {\\n            revert AuctionRegistry_RestrictedContractFactoryAccess();\\n        }\\n        _;\\n    }\\n\\n    modifier onlyAuctionInactive(\\n        address _nftAddress,\\n        uint256 _tokenId,\\n        address _auctionAddress\\n    ) {\\n        // if event still not ended, unable to create a same auction for the NFT\\n        // create interface of Auction.sol\\n        Auction auction = Auction(_auctionAddress);\\n        // call Auction.getEventState();\\n        require(\\n            auctionListings[_nftAddress][_tokenId] == address(0x0) ||\\n                (!auction.inClosedState() && !auction.inRegisteredState()),\\n            \\\"Duplicate auction for the vehicle is active!\\\"\\n        );\\n        _;\\n    }\\n\\n    function getContractType() public pure returns (Constants.ContractType) {\\n        return Constants.ContractType.AUCTION_REGISTRY;\\n    }\\n\\n    function setAuctionManagerAddress(address _auctionManagerAddress)\\n        public\\n        onlyOwner\\n    {\\n        auctionManagerAddress = _auctionManagerAddress;\\n        auctionManager = AuctionManager(auctionManagerAddress);\\n    }\\n\\n    function registerAuction(\\n        address _nftAddress,\\n        uint256 _tokenId,\\n        address _auctionAddress\\n    )\\n        public\\n        onlyContractFactory\\n        onlyAuctionInactive(_nftAddress, _tokenId, _auctionAddress)\\n    {\\n        // if NFT id not in map, store the NFT -> address mapping\\n        // else if NFT id already exist, update the mapping\\n        auctionListings[_nftAddress][_tokenId] = _auctionAddress; // this line does it all\\n    }\\n\\n    // TODO: registerTechnician\\n}\\n\\ncontract AuctionKeeper is KeeperCompatibleInterface {\\n    address public immutable owner;\\n    address public auctionManagerAddress;\\n    AuctionManager private auctionManager;\\n\\n    constructor() {\\n        owner = msg.sender;\\n    }\\n\\n    modifier onlyOwner() {\\n        if (msg.sender != owner) {\\n            revert AuctionRegistry_RestrictedOwnerAccess();\\n        }\\n        _;\\n    }\\n\\n    function getContractType() public pure returns (Constants.ContractType) {\\n        return Constants.ContractType.AUCTION_KEEPER;\\n    }\\n\\n    function setAuctionManagerAddress(address _auctionManagerAddress)\\n        public\\n        onlyOwner\\n    {\\n        auctionManagerAddress = _auctionManagerAddress;\\n        auctionManager = AuctionManager(auctionManagerAddress);\\n    }\\n\\n    function checkUpkeep(bytes calldata checkData)\\n        external\\n        view\\n        override\\n        returns (bool upkeepNeeded, bytes memory performData)\\n    {\\n        if (keccak256(checkData) == keccak256(hex\\\"01\\\")) {\\n            address[] memory biddingAuctions = auctionManager\\n                .getBiddingAuctions();\\n            upkeepNeeded = false;\\n            performData = checkData;\\n            for (uint i = 0; i < biddingAuctions.length; i++) {\\n                if (Auction(biddingAuctions[i]).getBidTimeLeft() == 0) {\\n                    upkeepNeeded = true;\\n                }\\n            }\\n            return (upkeepNeeded, performData);\\n        }\\n\\n        if (keccak256(checkData) == keccak256(hex\\\"02\\\")) {\\n            address[] memory verifyWinnerAuctions = auctionManager\\n                .getVerifyWinnerAuctions();\\n            upkeepNeeded = false;\\n            performData = checkData;\\n            for (uint i = 0; i < verifyWinnerAuctions.length; i++) {\\n                if (Auction(verifyWinnerAuctions[i]).getVerifyTimeLeft() == 0) {\\n                    upkeepNeeded = true;\\n                }\\n            }\\n            return (upkeepNeeded, performData);\\n        }\\n\\n        if (keccak256(checkData) == keccak256(hex\\\"03\\\")) {\\n            address[] memory pendingPaymentAuctions = auctionManager\\n                .getPendingPaymentAuctions();\\n            upkeepNeeded = false;\\n            performData = checkData;\\n            for (uint i = 0; i < pendingPaymentAuctions.length; i++) {\\n                if (\\n                    Auction(pendingPaymentAuctions[i]).getPaymentTimeLeft() == 0\\n                ) {\\n                    upkeepNeeded = true;\\n                }\\n            }\\n            return (upkeepNeeded, performData);\\n        }\\n    }\\n\\n    function performUpkeep(bytes calldata performData) external override {\\n        address[] memory biddingAuctions = auctionManager.getBiddingAuctions();\\n        if (keccak256(performData) == keccak256(hex\\\"01\\\")) {\\n            for (uint i = 0; i < biddingAuctions.length; i++) {\\n                if (Auction(biddingAuctions[i]).getBidTimeLeft() == 0) {\\n                    Auction(biddingAuctions[i]).endBidding();\\n                }\\n            }\\n        }\\n\\n        if (keccak256(performData) == keccak256(hex\\\"02\\\")) {\\n            address[] memory verifyWinnerAuctions = auctionManager\\n                .getVerifyWinnerAuctions();\\n            for (uint i = 0; i < verifyWinnerAuctions.length; i++) {\\n                if (Auction(verifyWinnerAuctions[i]).getVerifyTimeLeft() == 0) {\\n                    Auction(verifyWinnerAuctions[i]).verifyWinner(false);\\n                }\\n            }\\n        }\\n\\n        if (keccak256(performData) == keccak256(hex\\\"03\\\")) {\\n            address[] memory pendingPaymentAuctions = auctionManager\\n                .getPendingPaymentAuctions();\\n            for (uint i = 0; i < pendingPaymentAuctions.length; i++) {\\n                if (\\n                    Auction(pendingPaymentAuctions[i]).getPaymentTimeLeft() == 0\\n                ) {\\n                    Auction(pendingPaymentAuctions[i]).closeAuction(\\n                        Constants.AuctionEndState.PAYMENT_OVERDUE\\n                    );\\n                }\\n            }\\n        }\\n    }\\n}\\n\\ncontract AuctionManager {\\n    address[] public biddingAuctions;\\n    address[] public verifyWinnerAuctions;\\n    address[] public pendingPaymentAuctions;\\n    address auctionRegistryAddress;\\n    address eventEmitterAddress;\\n    address auctionKeeperAddress;\\n    address contractFactoryAddress;\\n\\n    constructor(\\n        address _auctionRegistryAddress,\\n        address _eventEmitterAddress,\\n        address _auctionKeeperAddress,\\n        address _contractFactoryAddress\\n    ) {\\n        auctionRegistryAddress = _auctionRegistryAddress;\\n        eventEmitterAddress = _eventEmitterAddress;\\n        auctionKeeperAddress = _auctionKeeperAddress;\\n        contractFactoryAddress = _contractFactoryAddress;\\n    }\\n\\n    function createAuction(address _nftAddress, uint256 _tokenId) external {\\n        ContractFactory contractFactory = ContractFactory(\\n            contractFactoryAddress\\n        );\\n        contractFactory.createAuction(\\n            msg.sender,\\n            _nftAddress,\\n            _tokenId,\\n            eventEmitterAddress,\\n            auctionKeeperAddress\\n        );\\n    }\\n\\n    function getBiddingAuctions() public view returns (address[] memory) {\\n        return biddingAuctions;\\n    }\\n\\n    function getVerifyWinnerAuctions() public view returns (address[] memory) {\\n        return verifyWinnerAuctions;\\n    }\\n\\n    function getPendingPaymentAuctions()\\n        public\\n        view\\n        returns (address[] memory)\\n    {\\n        return pendingPaymentAuctions;\\n    }\\n\\n    function getContractType() public pure returns (Constants.ContractType) {\\n        return Constants.ContractType.AUCTION_MANAGER;\\n    }\\n\\n    function addBiddingAuction(address _auctionAddress) public {\\n        require(\\n            AuctionUtility.getContractType(msg.sender) ==\\n                Constants.ContractType.AUCTION\\n        );\\n        // to be called when bidding starts (by Auction.startAuction())\\n        biddingAuctions.push(address(_auctionAddress));\\n    }\\n\\n    function removeBiddingAuction(address _auctionAddress) public {\\n        require(\\n            AuctionUtility.getContractType(msg.sender) ==\\n                Constants.ContractType.AUCTION\\n        );\\n        // to be called when bidding end time reached (by keepers)\\n        uint auctionIndex;\\n        int searchResult = searchBiddingAuction(_auctionAddress);\\n        if (searchResult >= 0) {\\n            auctionIndex = uint(searchResult);\\n            for (uint i = auctionIndex; i < biddingAuctions.length - 1; i++) {\\n                biddingAuctions[i] = biddingAuctions[i + 1];\\n            }\\n            biddingAuctions.pop();\\n        }\\n    }\\n\\n    function addVerifyWinnerAuction(address _auctionAddress) public {\\n        require(\\n            AuctionUtility.getContractType(msg.sender) ==\\n                Constants.ContractType.AUCTION\\n        );\\n        //  to be called when bidding end time reached (by keepers)\\n        verifyWinnerAuctions.push(address(_auctionAddress));\\n    }\\n\\n    function removeVerifyWinnerAuction(address _auctionAddress) public {\\n        require(\\n            AuctionUtility.getContractType(msg.sender) ==\\n                Constants.ContractType.AUCTION\\n        );\\n        // to be called when winner paid (by Auction.payFullSettlement()) / payment expiry time reached (by keepers)\\n        uint auctionIndex;\\n        int searchResult = searchVerifyWinnerAuction(_auctionAddress);\\n        if (searchResult >= 0) {\\n            auctionIndex = uint(searchResult);\\n            for (\\n                uint i = auctionIndex;\\n                i < verifyWinnerAuctions.length - 1;\\n                i++\\n            ) {\\n                verifyWinnerAuctions[i] = verifyWinnerAuctions[i + 1];\\n            }\\n            verifyWinnerAuctions.pop();\\n        }\\n    }\\n\\n    function addPendingPaymentAuction(address _auctionAddress) public {\\n        require(\\n            AuctionUtility.getContractType(msg.sender) ==\\n                Constants.ContractType.AUCTION\\n        );\\n        // to be called when bidding end time reached (by keepers)\\n        pendingPaymentAuctions.push(address(_auctionAddress));\\n    }\\n\\n    function removePendingPaymentAuction(address _auctionAddress) public {\\n        require(\\n            AuctionUtility.getContractType(msg.sender) ==\\n                Constants.ContractType.AUCTION\\n        );\\n        // to be called when winner paid (by Auction.payFullSettlement()) / payment expiry time reached (by keepers)\\n        uint auctionIndex;\\n        int searchResult = searchPendingPaymentAuction(_auctionAddress);\\n        if (searchResult >= 0) {\\n            auctionIndex = uint(searchResult);\\n            for (\\n                uint i = auctionIndex;\\n                i < pendingPaymentAuctions.length - 1;\\n                i++\\n            ) {\\n                pendingPaymentAuctions[i] = pendingPaymentAuctions[i + 1];\\n            }\\n            pendingPaymentAuctions.pop();\\n        }\\n    }\\n\\n    function searchBiddingAuction(address _auctionAddress)\\n        public\\n        view\\n        returns (int)\\n    {\\n        for (uint i = 0; i < uint(biddingAuctions.length); i++) {\\n            if (biddingAuctions[i] == _auctionAddress) {\\n                return int(i);\\n            }\\n        }\\n        return -1;\\n    }\\n\\n    function searchVerifyWinnerAuction(address _auctionAddress)\\n        public\\n        view\\n        returns (int)\\n    {\\n        for (uint i = 0; i < uint(verifyWinnerAuctions.length); i++) {\\n            if (verifyWinnerAuctions[i] == _auctionAddress) {\\n                return int(i);\\n            }\\n        }\\n        return -1;\\n    }\\n\\n    function searchPendingPaymentAuction(address _auctionAddress)\\n        public\\n        view\\n        returns (int)\\n    {\\n        for (uint i = 0; i < uint(pendingPaymentAuctions.length); i++) {\\n            if (pendingPaymentAuctions[i] == _auctionAddress) {\\n                return int(i);\\n            }\\n        }\\n        return -1;\\n    }\\n}\\n\\n/*\\n1. Seller can start the auction directly or choose to send the vehicle for verification\\n2. Seller must set the duration for the auction and the starting price for the auction\\n3. Bidder can join the auction by paying a deposit of 500$, the deposit only has to be paid once\\n4. The deposit can be reclaimed by bidder after the auction ends,\\n    if the bidder lost the auction or \\n    the bidder won the auction and settled the full payment of the vehicle\\n5. Bidder can bid for the vehicle provided that the new bid is higher than the current highest bid\\n6. Seller cannot bid on their own auction\\n7. When the highese bid is updated within 60 seconds of the ending time, \\n    the duration of the auction will be reset to 3 minutes\\n8. The winner of the auction will be the bidder with the highest bid when the auction ends\\n9. The ownership of the auction will be transferred to the winner once the winner settled the payment\\n10. The payment must be exactly the amount of the winning bid\\n11. The payment must be made within 1 day(s) after the auction ends, \\n    otherwise payment cannot be made and the NFT will not be transferred\\n12. If no one bid on the vehicle after the bidding time is up, the auctin will end with EndState.NO_BIDDER\\n*/\\ncontract Auction {\\n    enum AuctionState {\\n        REGISTERED,\\n        BIDDING,\\n        VERIFYING_WINNER,\\n        PENDING_PAYMENT,\\n        PENDING_AUDIT,\\n        AUCTION_CLOSED\\n    }\\n\\n    address payable public immutable platformOwner;\\n    address payable public immutable seller;\\n    address public nftAddress;\\n    uint256 public tokenId;\\n    address private auctionKeeperAddress;\\n    address private auctionManagerAddress;\\n    AuctionManager private auctionManager;\\n    EventEmitter private eventEmitter;\\n    uint128 public depositUSD = 1;\\n    uint256 public depositWei;\\n    uint256 public bidStartTime;\\n    uint256 public bidEndTime;\\n    uint128 public durationSec;\\n    uint256 public verify_startTime;\\n    uint256 public verify_expiryTime;\\n    uint256 public verify_duration = 1 days;\\n    uint256 public payment_startTime;\\n    uint256 public payment_expiryTime;\\n    uint256 public payment_duration = 1 days;\\n    uint256 public platformCharge;\\n    AuctionState public currAuctionState = AuctionState.REGISTERED;\\n    Constants.AuctionEndState public auctionEndState =\\n        Constants.AuctionEndState.NOT_ENDED;\\n    uint256 public highestBid;\\n    address public highestBidder;\\n    bool winnerPaid = false;\\n    mapping(address => uint128) private bidderToDeposits;\\n    mapping(address => uint256) private addressToProceeds;\\n\\n    constructor(\\n        address _platformOwner,\\n        address _seller,\\n        address _auctionManagerAddress,\\n        address _eventEmitterAddress,\\n        address _auctionKeeperAddress,\\n        address _nftAddress,\\n        uint256 _tokenId\\n    ) {\\n        platformOwner = payable(_platformOwner);\\n        seller = payable(_seller);\\n        auctionManagerAddress = _auctionManagerAddress;\\n        auctionKeeperAddress = _auctionKeeperAddress;\\n        auctionManager = AuctionManager(_auctionManagerAddress);\\n        eventEmitter = EventEmitter(_eventEmitterAddress);\\n        nftAddress = _nftAddress;\\n        tokenId = _tokenId;\\n        currAuctionState = AuctionState.REGISTERED;\\n        depositWei = AuctionUtility.convertUsdToWei(depositUSD);\\n        eventEmitter.emitAuctionRegistered(\\n            address(this),\\n            _seller,\\n            _nftAddress,\\n            _tokenId,\\n            block.timestamp\\n        );\\n    }\\n\\n    modifier onlySeller() {\\n        if (msg.sender != seller) {\\n            revert Auction_RestrictedSellerAccess();\\n        }\\n        _;\\n    }\\n\\n    modifier onlySellerOrKeeper() {\\n        if ((msg.sender != seller) && (msg.sender != auctionKeeperAddress)) {\\n            revert Auction_RestrictedSellerAccess();\\n        }\\n        _;\\n    }\\n\\n    modifier onlyWinnerPayment() {\\n        if (msg.sender != highestBidder && !(inPendingPaymentState())) {\\n            revert Auction_RestrictedWinnerPaymentAccess();\\n        }\\n        _;\\n    }\\n\\n    modifier notForSeller() {\\n        if (msg.sender == seller) {\\n            revert Auction_SelfBiddingIsNotAllowed();\\n        }\\n        _;\\n    }\\n\\n    modifier onlyAuthority(address _user) {\\n        (bool success, bytes memory data) = nftAddress.call(\\n            abi.encodeWithSignature(\\\"getAuthorityAddress()\\\")\\n        );\\n        require(success, \\\"Unable to determine the contract type!\\\");\\n        address authority = abi.decode(data, (address));\\n        if (_user != authority) {\\n            revert Auction_UnauthorizedAccess();\\n        }\\n        _;\\n    }\\n\\n    modifier onlyNftContract() {\\n        require(msg.sender == nftAddress);\\n        _;\\n    }\\n\\n    function getContractType() public pure returns (Constants.ContractType) {\\n        return Constants.ContractType.AUCTION;\\n    }\\n\\n    function inRegisteredState() public view returns (bool) {\\n        if (currAuctionState == AuctionState.REGISTERED) {\\n            return true;\\n        } else {\\n            return false;\\n        }\\n    }\\n\\n    function inBiddingState() public view returns (bool) {\\n        if (currAuctionState == AuctionState.BIDDING) {\\n            return true;\\n        } else {\\n            return false;\\n        }\\n    }\\n\\n    function inVerifyWinnerState() public view returns (bool) {\\n        if (currAuctionState == AuctionState.VERIFYING_WINNER) {\\n            return true;\\n        } else {\\n            return false;\\n        }\\n    }\\n\\n    function inPendingPaymentState() public view returns (bool) {\\n        if (currAuctionState == AuctionState.PENDING_PAYMENT) {\\n            return true;\\n        } else {\\n            return false;\\n        }\\n    }\\n\\n    function inPendingAuditState() public view returns (bool) {\\n        if (currAuctionState == AuctionState.PENDING_AUDIT) {\\n            return true;\\n        } else {\\n            return false;\\n        }\\n    }\\n\\n    function inClosedState() public view returns (bool) {\\n        if (currAuctionState == AuctionState.AUCTION_CLOSED) {\\n            return true;\\n        } else {\\n            return false;\\n        }\\n    }\\n\\n    function startAuction(uint128 _durationSec, uint128 _startingBid) external {\\n        require(inRegisteredState(), \\\"Auction not in Registered state!\\\");\\n        require(msg.sender == seller, \\\"Requires owner!\\\");\\n        require(_startingBid > 0, \\\"Start bid < 0!\\\");\\n        bidStartTime = block.timestamp;\\n        bidEndTime = bidStartTime + _durationSec;\\n        durationSec = _durationSec;\\n        highestBid = _startingBid;\\n        currAuctionState = AuctionState.BIDDING;\\n\\n        eventEmitter.emitAuctionStartedBidding(\\n            address(this),\\n            seller,\\n            nftAddress,\\n            tokenId,\\n            depositWei,\\n            bidStartTime,\\n            bidEndTime,\\n            _startingBid\\n        );\\n        auctionManager.addBiddingAuction(address(this));\\n    }\\n\\n    function endBidding() public {\\n        require(inBiddingState(), \\\"Illegal state!\\\");\\n        require(block.timestamp >= bidEndTime, \\\"Bid time > 0!\\\");\\n        if (highestBidder == address(0x0)) {\\n            closeAuction(Constants.AuctionEndState.NO_BIDDER);\\n        } else {\\n            currAuctionState = AuctionState.VERIFYING_WINNER;\\n            verify_startTime = block.timestamp;\\n            verify_expiryTime = verify_startTime + verify_duration;\\n            platformCharge = AuctionUtility.getPlatformCharge(highestBid);\\n            eventEmitter.emitAuctionVerifyingWinner(\\n                address(this),\\n                seller,\\n                nftAddress,\\n                tokenId,\\n                highestBidder,\\n                highestBid,\\n                platformCharge,\\n                verify_startTime,\\n                verify_expiryTime\\n            );\\n            auctionManager.addVerifyWinnerAuction(address(this));\\n        }\\n        auctionManager.removeBiddingAuction(address(this));\\n    }\\n\\n    function verifyWinner(bool approveWinningBid) external onlySellerOrKeeper {\\n        // when timer's up, keepers call this function, verifyWinner(false)\\n        require(inVerifyWinnerState(), \\\"Illegal state!\\\");\\n        require(getVerifyTimeLeft() > 0, \\\"Verify expired!\\\");\\n        if (approveWinningBid) {\\n            payment_startTime = block.timestamp;\\n            payment_expiryTime = payment_startTime + payment_duration;\\n            currAuctionState = AuctionState.PENDING_PAYMENT;\\n            eventEmitter.emitAuctionPendingPayment(\\n                address(this),\\n                seller,\\n                nftAddress,\\n                tokenId,\\n                highestBidder,\\n                highestBid,\\n                payment_startTime,\\n                payment_expiryTime\\n            );\\n            auctionManager.removeVerifyWinnerAuction(address(this));\\n            auctionManager.addPendingPaymentAuction(address(this));\\n        } else {\\n            closeAuction(Constants.AuctionEndState.REJECTED_BY_SELLER);\\n            auctionManager.removeVerifyWinnerAuction(address(this));\\n        }\\n    }\\n\\n    function closeAuction(Constants.AuctionEndState _endState) public {\\n        // can only be closed when the winner pays or the payment pending expired (chainlink keepers trigger)\\n\\n        if (_endState == Constants.AuctionEndState.NO_BIDDER) {\\n            require(\\n                currAuctionState == AuctionState.BIDDING,\\n                \\\"Illegal state transition!\\\"\\n            );\\n            require(getBidTimeLeft() == 0, \\\"auction still bidding!\\\");\\n            require(\\n                highestBidder == address(0x0),\\n                \\\"closeAuction.NO_BIDDER must not have winner!\\\"\\n            );\\n        } else if (_endState == Constants.AuctionEndState.REJECTED_BY_SELLER) {\\n            require(\\n                currAuctionState == AuctionState.VERIFYING_WINNER,\\n                \\\"illegal state transition!\\\"\\n            );\\n            require(\\n                msg.sender == seller ||\\n                    AuctionUtility.getContractType(msg.sender) ==\\n                    Constants.ContractType.AUCTION_KEEPER,\\n                \\\"closeAuction requires seller or keeper!\\\"\\n            );\\n        } else if (_endState == Constants.AuctionEndState.PAYMENT_OVERDUE) {\\n            require(\\n                currAuctionState == AuctionState.PENDING_PAYMENT,\\n                \\\"illegal state transition!\\\"\\n            );\\n            require(\\n                msg.sender == seller ||\\n                    AuctionUtility.getContractType(msg.sender) ==\\n                    Constants.ContractType.AUCTION_KEEPER,\\n                \\\"closeAuction requires seller or keeper!\\\"\\n            );\\n            require(winnerPaid == false, \\\"winner already paid!\\\");\\n            // TODO: transfer winner's deposit to platform_owner\\n        } else if (\\n            (_endState == Constants.AuctionEndState.OWNERSHIP_TRANSFERRED) ||\\n            (_endState == Constants.AuctionEndState.AUDIT_REJECTED)\\n        ) {\\n            require(\\n                currAuctionState == AuctionState.PENDING_AUDIT,\\n                \\\"illegal state transition!\\\"\\n            );\\n            require(msg.sender == nftAddress, \\\"only Auditor\\\");\\n        } else {\\n            // else if (_endState == Constants.AuctionEndState.CANCELED)\\n            require(\\n                currAuctionState == AuctionState.REGISTERED,\\n                \\\"illegal state transition!\\\"\\n            );\\n            require(msg.sender == seller, \\\"only seller!\\\");\\n        }\\n\\n        currAuctionState = AuctionState.AUCTION_CLOSED;\\n        auctionEndState = _endState;\\n        eventEmitter.emitAuctionClosed(\\n            address(this),\\n            seller,\\n            nftAddress,\\n            tokenId,\\n            block.timestamp,\\n            highestBidder,\\n            highestBid,\\n            _endState\\n        );\\n        if ((_endState == Constants.AuctionEndState.PAYMENT_OVERDUE)) {\\n            auctionManager.removePendingPaymentAuction(address(this));\\n        }\\n    }\\n\\n    function placeDeposit() external payable notForSeller {\\n        require(inBiddingState(), \\\"Illegal state!\\\");\\n        require((bidderToDeposits[msg.sender] == 0), \\\"Account deposited!\\\");\\n        require((msg.value >= depositWei), \\\"Wrong deposit amount!\\\");\\n        bidderToDeposits[msg.sender] += uint128(msg.value);\\n        eventEmitter.emitAuctionDepositPlaced(\\n            address(this),\\n            nftAddress,\\n            tokenId,\\n            msg.sender,\\n            msg.value,\\n            block.timestamp\\n        );\\n    }\\n\\n    function placeBid(uint256 _bidAmount) external notForSeller {\\n        require(inBiddingState(), \\\"Illegal state!\\\");\\n        require(getBidTimeLeft() > 0, \\\"Bid ongoing!\\\");\\n        require(\\n            (bidderToDeposits[msg.sender] >= depositWei),\\n            \\\"Deposit required for bidding!\\\"\\n        );\\n        require(_bidAmount > highestBid, \\\"Bid lower than highest bid!\\\");\\n\\n        highestBid = _bidAmount;\\n        highestBidder = msg.sender;\\n        eventEmitter.emitAuctionBidPlaced(\\n            address(this),\\n            nftAddress,\\n            tokenId,\\n            msg.sender,\\n            _bidAmount,\\n            block.timestamp\\n        );\\n    }\\n\\n    function withdrawDeposit() external payable {\\n        require(\\n            ((msg.sender != highestBidder) ||\\n                (msg.sender == highestBidder && winnerPaid == true) ||\\n                (msg.sender == highestBidder && inClosedState())),\\n            \\\"Cannot withdraw!\\\"\\n        );\\n        // requires bidder to settle full payment for withdrawal (full payment only when the seller accepted the result)\\n        // requires bidder to not exceed the expiry date for full payment settlement\\n        // close the auction when the expiry date is reached\\n        uint128 depositBalance = bidderToDeposits[msg.sender];\\n        bidderToDeposits[msg.sender] = 0;\\n        (bool sent, ) = payable(msg.sender).call{value: depositBalance}(\\\"\\\");\\n        require(sent, \\\"ETH withdrawal failed!\\\");\\n        eventEmitter.emitAuctionDepositRetrieved(\\n            address(this),\\n            nftAddress,\\n            tokenId,\\n            msg.sender,\\n            depositBalance,\\n            block.timestamp\\n        );\\n    }\\n\\n    function payFullSettlement() external payable onlyWinnerPayment {\\n        require((inPendingPaymentState()), \\\"Illegal state!\\\");\\n        require(\\n            (getPaymentTimeLeft() > 0),\\n            \\\"Payment window for full settlement closed!\\\"\\n        );\\n        require(\\n            (msg.value == (highestBid + platformCharge)),\\n            \\\"Payment value != (winning bid + platform charge)!\\\"\\n        );\\n        require((!winnerPaid), \\\"You have paid!\\\");\\n        addressToProceeds[seller] = highestBid;\\n        addressToProceeds[platformOwner] = platformCharge;\\n        winnerPaid = true;\\n        auctionManager.removePendingPaymentAuction(address(this));\\n        eventEmitter.emitAuctionFullSettlementPaid(\\n            address(this),\\n            nftAddress,\\n            tokenId,\\n            msg.sender,\\n            seller,\\n            msg.value,\\n            block.timestamp\\n        );\\n        currAuctionState = AuctionState.PENDING_AUDIT;\\n    }\\n\\n    function withdrawSellerEarnings() external onlySeller {\\n        require(\\n            (auctionEndState ==\\n                Constants.AuctionEndState.OWNERSHIP_TRANSFERRED),\\n            \\\"Ownership not transferred!\\\"\\n        );\\n        uint256 proceeds = addressToProceeds[seller];\\n        if (proceeds <= 0) {\\n            revert Auction_NoProceeds();\\n        }\\n        (bool sent, ) = payable(seller).call{value: proceeds}(\\\"\\\");\\n        require(sent, \\\"ETH transfer failed\\\");\\n        addressToProceeds[seller] = 0;\\n        eventEmitter.emitSellerEarningsRetrieved(\\n            address(this),\\n            nftAddress,\\n            tokenId,\\n            msg.sender,\\n            proceeds,\\n            block.timestamp\\n        );\\n    }\\n\\n    function refundFullSettlement() external {\\n        require(\\n            msg.sender == highestBidder,\\n            \\\"Refund can only be made to payer!\\\"\\n        );\\n        require(\\n            auctionEndState == Constants.AuctionEndState.AUDIT_REJECTED,\\n            \\\"Inegligible for refund!\\\"\\n        );\\n        uint256 proceeds = addressToProceeds[seller] +\\n            addressToProceeds[platformOwner];\\n        if (proceeds <= 0) {\\n            revert Auction_NoProceeds();\\n        }\\n        (bool sent, ) = payable(highestBidder).call{value: (proceeds)}(\\\"\\\");\\n        require(sent, \\\"ETH transfer failed\\\");\\n        addressToProceeds[seller] = 0;\\n        addressToProceeds[seller] = 0;\\n        eventEmitter.emitWinnerPaymentRefunded(\\n            address(this),\\n            nftAddress,\\n            tokenId,\\n            msg.sender,\\n            proceeds,\\n            block.timestamp\\n        );\\n    }\\n\\n    function setAuditResult(bool _valid) external onlyNftContract {\\n        if (_valid == true) {\\n            closeAuction(Constants.AuctionEndState.OWNERSHIP_TRANSFERRED);\\n            uint256 proceeds = addressToProceeds[platformOwner];\\n            (bool sent, ) = payable(platformOwner).call{value: proceeds}(\\\"\\\");\\n            require(sent, \\\"ETH transfer failed\\\");\\n            addressToProceeds[platformOwner] = 0;\\n        } else {\\n            closeAuction(Constants.AuctionEndState.AUDIT_REJECTED);\\n        }\\n        eventEmitter.emitAuctionAuditResult(\\n            address(this),\\n            seller,\\n            nftAddress,\\n            tokenId,\\n            highestBidder,\\n            highestBid,\\n            block.timestamp,\\n            _valid\\n        );\\n    }\\n\\n    function getBidTimeLeft() public view returns (uint256) {\\n        if (block.timestamp > bidEndTime) {\\n            return 0;\\n        } else {\\n            return (bidEndTime - block.timestamp);\\n        }\\n    }\\n\\n    function getVerifyTimeLeft() public view returns (uint256) {\\n        if (block.timestamp > verify_expiryTime) {\\n            return 0;\\n        } else {\\n            return (verify_expiryTime - block.timestamp);\\n        }\\n    }\\n\\n    function getPaymentTimeLeft() public view returns (uint256) {\\n        if (block.timestamp > payment_expiryTime) {\\n            return 0;\\n        } else {\\n            return (payment_expiryTime - block.timestamp);\\n        }\\n    }\\n}\\n\",\"keccak256\":\"0x3b14dc75a07f79c7d08f2b351e1a074dc8de90e0c95d2e2722de78d17cbcb950\",\"license\":\"MIT\"},\"libraries/AuctionUtility.sol\":{\"content\":\"// SPDX-License-Identifier: MIT\\npragma solidity ^0.8.8;\\nimport \\\"@chainlink/contracts/src/v0.8/interfaces/AggregatorV3Interface.sol\\\";\\n\\nlibrary AuctionUtility {\\n    function getWeiPerUsdRate() internal view returns (uint256) {\\n        // for testnet\\n        /*\\n        AggregatorV3Interface priceFeed = AggregatorV3Interface(\\n            0xD4a33860578De61DBAbDc8BFdb98FD742fA7028e\\n        );\\n        (, int256 price, , , ) = priceFeed.latestRoundData(); // WeiPerUsd (in 8 decimals)\\n        */\\n        // for local network\\n        int256 price = 132102000000;\\n\\n        return uint256(price * 1e10);\\n    }\\n\\n    function convertWeiToUsd(uint256 p_weiAmount)\\n        internal\\n        view\\n        returns (uint256)\\n    {\\n        uint256 ethRate = getWeiPerUsdRate();\\n        uint256 usdEquivalent = (p_weiAmount * ethRate) / (1e18 * 1e18);\\n        return usdEquivalent;\\n    }\\n\\n    function convertUsdToWei(uint256 p_usdAmount)\\n        internal\\n        view\\n        returns (uint256)\\n    {\\n        uint256 ethRate = getWeiPerUsdRate();\\n        uint256 weiEquivalent = (1e18 * 1e18) / (p_usdAmount * ethRate);\\n        return weiEquivalent;\\n    }\\n\\n    function hourToSec(uint inHours) internal pure returns (uint256 inMinutes) {\\n        return (inHours * 60 * 60);\\n    }\\n\\n    function getContractType(address _contractAddress)\\n        internal\\n        returns (Constants.ContractType)\\n    {\\n        (bool success, bytes memory data) = _contractAddress.call(\\n            abi.encodeWithSignature(\\\"getContractType()\\\")\\n        );\\n        require(success, \\\"Unable to determine the contract type!\\\");\\n        return abi.decode(data, (Constants.ContractType));\\n    }\\n\\n    function getPlatformCharge(uint256 highestBid)\\n        internal\\n        pure\\n        returns (uint256 platformCharge)\\n    {\\n        return (highestBid * Constants.platformChargeRate) / 100;\\n    }\\n}\\n\\nlibrary Constants {\\n    enum ContractType {\\n        AUCTION,\\n        AUCTION_MANAGER,\\n        AUCTION_REGISTRY,\\n        CONTRACT_FACTORY,\\n        AUCTION_KEEPER\\n    }\\n\\n    enum AuctionEndState {\\n        NOT_ENDED,\\n        CANCELED,\\n        NO_BIDDER,\\n        REJECTED_BY_SELLER,\\n        PAYMENT_OVERDUE,\\n        AUDIT_REJECTED,\\n        OWNERSHIP_TRANSFERRED\\n    }\\n\\n    enum PlatformEarnings {\\n        DEPOSIT, // when winner did not pay full settlement\\n        FULL_SETTLEMENT // when auction passed audit\\n    }\\n\\n    uint32 internal constant platformChargeRate = 5; // 5 percent\\n}\\n\",\"keccak256\":\"0x320a6e720a495b8cb774c1aef8d574944e9603cd2c184c0d412ff1c0f238ea8e\",\"license\":\"MIT\"}},\"version\":1}",
  "bytecode": "0x608060405234801561001057600080fd5b506112f7806100206000396000f3fe608060405234801561001057600080fd5b50600436106100cf5760003560e01c80639ce3a7b21161008c578063ae69121c11610066578063ae69121c14610181578063d3b63be814610194578063e08ea11a146101a7578063ef415bb6146101ba57600080fd5b80639ce3a7b214610148578063a02cc9571461015b578063a780a0321461016e57600080fd5b80630eb941ff146100d45780632eca920f146100e95780632f7a085b146100fc57806379cb66b91461010f5780638dcf508d14610122578063917e705814610135575b600080fd5b6100e76100e23660046109d1565b6101cd565b005b6100e76100f7366004610ab0565b610272565b6100e761010a366004610b63565b610313565b6100e761011d366004610c19565b610399565b6100e7610130366004610cbc565b61041f565b6100e7610143366004610d5b565b6104b5565b6100e7610156366004610dcb565b61053b565b6100e7610169366004610dcb565b6105c6565b6100e761017c366004610e6d565b610659565b6100e761018f366004610dcb565b6106ea565b6100e76101a2366004610dcb565b61076c565b6100e76101b5366004610ee5565b6107ee565b6100e76101c8366004610dcb565b610843565b3360006101d9826108c5565b60048111156101ea576101ea610f3f565b146102105760405162461bcd60e51b815260040161020790610f9c565b60405180910390fd5b856001600160a01b0316878b6001600160a01b03167fb599fff20cd0cdacf6eba4e160e8d8009e20988c1eae26a9adbacd0825e57fe68c8c8a8a8a8a60405161025e96959493929190610fc1565b60405180910390a450505050505050505050565b33600061027e826108c5565b600481111561028f5761028f610f3f565b146102ac5760405162461bcd60e51b815260040161020790610f9c565b8160068111156102be576102be610f3f565b868a6001600160a01b03167fc5afeb842b1ee0a786f0181fd50d600ada6f7182ac63862b96f7f442770648b28b8b8a8a8a60405161030095949392919061101b565b60405180910390a4505050505050505050565b33600061031f826108c5565b600481111561033057610330610f3f565b1461034d5760405162461bcd60e51b815260040161020790610f9c565b85876001600160a01b03168a6001600160a01b03167f24eb4b3ed711873687e910758f75270c9463ed43b0ed071bdd590a4300bcd88e8b89898989604051610300959493929190611067565b3360006103a5826108c5565b60048111156103b6576103b6610f3f565b146103d35760405162461bcd60e51b815260040161020790610f9c565b846001600160a01b0316868a6001600160a01b03167f9508ec25b144da066199b5989b94395f140d3fa4b4b89d9d1fe759b3a56207818b8b8989896040516103009594939291906110a4565b33600061042b826108c5565b600481111561043c5761043c610f3f565b146104595760405162461bcd60e51b815260040161020790610f9c565b82856001600160a01b0316896001600160a01b03167fd9aab4ab40bdf963884f8195430dfa8cfb4f612db68e77014f08b1572104386d8a8a89886040516104a394939291906110e6565b60405180910390a45050505050505050565b3360006104c1826108c5565b60048111156104d2576104d2610f3f565b146104ef5760405162461bcd60e51b815260040161020790610f9c565b846001600160a01b0316868a6001600160a01b03167fff4bb47ee7dfdeaa91aa6bb72cb414f4a5417cb8b7856c50518377140a76f84f8b8b898989604051610300959493929190611124565b336000610547826108c5565b600481111561055857610558610f3f565b146105755760405162461bcd60e51b815260040161020790610f9c565b82876001600160a01b03167f6dea70ae06d45c8fa6812244450ca27a1739b5ff5959d5d78e175529596fdf4a888888876040516105b594939291906110e6565b60405180910390a350505050505050565b3360006105d2826108c5565b60048111156105e3576105e3610f3f565b146106005760405162461bcd60e51b815260040161020790610f9c565b84866001600160a01b0316886001600160a01b03167f9ae6f0a8ca0d7d683b3c09bd0ae5753f0e32122471cfd78314043b23098a6c248787876040516106489392919061113f565b60405180910390a450505050505050565b336000610665826108c5565b600481111561067657610676610f3f565b146106935760405162461bcd60e51b815260040161020790610f9c565b836001600160a01b0316866001600160a01b03167f3ec02074dff7cee356720b1f6e201d35ea87c45961d9d9e3cc4ff52147908bc28786866040516106da9392919061119a565b60405180910390a3505050505050565b3360006106f6826108c5565b600481111561070757610707610f3f565b146107245760405162461bcd60e51b815260040161020790610f9c565b84866001600160a01b0316886001600160a01b03167f61f5631971566b3768bafba61e9d2a9b41fcffa03bd2a2c2226c2187b9d4fbb48787876040516106489392919061113f565b336000610778826108c5565b600481111561078957610789610f3f565b146107a65760405162461bcd60e51b815260040161020790610f9c565b84866001600160a01b0316886001600160a01b03167f2babdf2515139b15f37dbc4b16e25fe27d46327703abc50cd73c7acb5369e3cc8787876040516106489392919061113f565b81836001600160a01b0316866001600160a01b03167f34d6b4d35fa401c6a7d3efae588ddd17d510ceb459bf4af495f1498706fd44c187856040516108349291906111b5565b60405180910390a45050505050565b33600061084f826108c5565b600481111561086057610860610f3f565b1461087d5760405162461bcd60e51b815260040161020790610f9c565b82846001600160a01b0316886001600160a01b03167f106d24c70bbf2f6dbb6d5fa931e9951c1809fa791d8239136c544c36ecb6b8e88989876040516106489392919061113f565b60408051600481526024810182526020810180516001600160e01b0316630628d14f60e51b1790529051600091829182916001600160a01b0386169161090b9190611229565b6000604051808303816000865af19150503d8060008114610948576040519150601f19603f3d011682016040523d82523d6000602084013e61094d565b606091505b50915091508161096f5760405162461bcd60e51b815260040161020790611278565b8080602001905181019061098391906112a0565b949350505050565b60006001600160a01b0382165b92915050565b6109a78161098b565b81146109b257600080fd5b50565b80356109988161099e565b806109a7565b8035610998816109c0565b60008060008060008060008060006101208a8c0312156109f3576109f3600080fd5b60006109ff8c8c6109b5565b9950506020610a108c828d016109b5565b9850506040610a218c828d016109b5565b9750506060610a328c828d016109c6565b9650506080610a438c828d016109b5565b95505060a0610a548c828d016109c6565b94505060c0610a658c828d016109c6565b93505060e0610a768c828d016109c6565b925050610100610a888c828d016109c6565b9150509295985092959850929598565b600781106109b257600080fd5b803561099881610a98565b600080600080600080600080610100898b031215610ad057610ad0600080fd5b6000610adc8b8b6109b5565b9850506020610aed8b828c016109b5565b9750506040610afe8b828c016109b5565b9650506060610b0f8b828c016109c6565b9550506080610b208b828c016109c6565b94505060a0610b318b828c016109b5565b93505060c0610b428b828c016109c6565b92505060e0610b538b828c01610aa5565b9150509295985092959890939650565b600080600080600080600080610100898b031215610b8357610b83600080fd5b6000610b8f8b8b6109b5565b9850506020610ba08b828c016109b5565b9750506040610bb18b828c016109b5565b9650506060610bc28b828c016109c6565b9550506080610bd38b828c016109c6565b94505060a0610be48b828c016109c6565b93505060c0610bf58b828c016109c6565b92505060e0610b538b828c016109c6565b8015156109a7565b803561099881610c06565b600080600080600080600080610100898b031215610c3957610c39600080fd5b6000610c458b8b6109b5565b9850506020610c568b828c016109b5565b9750506040610c678b828c016109b5565b9650506060610c788b828c016109c6565b9550506080610c898b828c016109b5565b94505060a0610c9a8b828c016109c6565b93505060c0610cab8b828c016109c6565b92505060e0610b538b828c01610c0e565b600080600080600080600060e0888a031215610cda57610cda600080fd5b6000610ce68a8a6109b5565b9750506020610cf78a828b016109b5565b9650506040610d088a828b016109c6565b9550506060610d198a828b016109b5565b9450506080610d2a8a828b016109b5565b93505060a0610d3b8a828b016109c6565b92505060c0610d4c8a828b016109c6565b91505092959891949750929550565b600080600080600080600080610100898b031215610d7b57610d7b600080fd5b6000610d878b8b6109b5565b9850506020610d988b828c016109b5565b9750506040610da98b828c016109b5565b9650506060610dba8b828c016109c6565b9550506080610bd38b828c016109b5565b60008060008060008060c08789031215610de757610de7600080fd5b6000610df389896109b5565b9650506020610e0489828a016109b5565b9550506040610e1589828a016109c6565b9450506060610e2689828a016109b5565b9350506080610e3789828a016109c6565b92505060a0610e4889828a016109c6565b9150509295509295509295565b600281106109b257600080fd5b803561099881610e55565b600080600080600060a08688031215610e8857610e88600080fd5b6000610e9488886109b5565b9550506020610ea5888289016109b5565b9450506040610eb6888289016109b5565b9350506060610ec788828901610e62565b9250506080610ed8888289016109c6565b9150509295509295909350565b600080600080600060a08688031215610f0057610f00600080fd5b6000610f0c88886109b5565b9550506020610f1d888289016109b5565b9450506040610f2e888289016109b5565b9350506060610ec7888289016109c6565b634e487b7160e01b600052602160045260246000fd5b602781526000602082017f6576656e74456d69742063616e206f6e6c792062652063616c6c65642062792081526620bab1ba34b7b760c91b602082015291505b5060400190565b6020808252810161099881610f55565b610fb58161098b565b82525050565b80610fb5565b60c08101610fcf8289610fac565b610fdc6020830188610fac565b610fe96040830187610fbb565b610ff66060830186610fbb565b6110036080830185610fbb565b61101060a0830184610fbb565b979650505050505050565b60a081016110298288610fac565b6110366020830187610fac565b6110436040830186610fbb565b6110506060830185610fac565b61105d6080830184610fbb565b9695505050505050565b60a081016110758288610fac565b6110826020830187610fbb565b61108f6040830186610fbb565b6110506060830185610fbb565b801515610fb5565b60a081016110b28288610fac565b6110bf6020830187610fac565b6110cc6040830186610fbb565b6110d96060830185610fbb565b61105d608083018461109c565b608081016110f48287610fac565b6111016020830186610fbb565b61110e6040830185610fac565b61111b6060830184610fbb565b95945050505050565b60a081016111328288610fac565b6110826020830187610fac565b6060810161114d8286610fac565b61115a6020830185610fbb565b6109836040830184610fbb565b600281106109b2576109b2610f3f565b8061118181611167565b919050565b600061099882611177565b610fb581611186565b606081016111a88286610fac565b61115a6020830185611191565b604081016111c38285610fac565b6111d06020830184610fbb565b9392505050565b60005b838110156111f25781810151838201526020016111da565b83811115611201576000848401525b50505050565b6000611211825190565b61121f8185602086016111d7565b9290920192915050565b60006111d08284611207565b602681526000602082017f556e61626c6520746f2064657465726d696e652074686520636f6e747261637481526520747970652160d01b60208201529150610f95565b6020808252810161099881611235565b600581106109b257600080fd5b805161099881611288565b6000602082840312156112b5576112b5600080fd5b6000610983848461129556fea264697066735822122088f63d9cb133fcbe483822e104f2f12b11d88efc622f185be02fd35592d4a28464736f6c63430008080033",
  "deployedBytecode": "0x608060405234801561001057600080fd5b50600436106100cf5760003560e01c80639ce3a7b21161008c578063ae69121c11610066578063ae69121c14610181578063d3b63be814610194578063e08ea11a146101a7578063ef415bb6146101ba57600080fd5b80639ce3a7b214610148578063a02cc9571461015b578063a780a0321461016e57600080fd5b80630eb941ff146100d45780632eca920f146100e95780632f7a085b146100fc57806379cb66b91461010f5780638dcf508d14610122578063917e705814610135575b600080fd5b6100e76100e23660046109d1565b6101cd565b005b6100e76100f7366004610ab0565b610272565b6100e761010a366004610b63565b610313565b6100e761011d366004610c19565b610399565b6100e7610130366004610cbc565b61041f565b6100e7610143366004610d5b565b6104b5565b6100e7610156366004610dcb565b61053b565b6100e7610169366004610dcb565b6105c6565b6100e761017c366004610e6d565b610659565b6100e761018f366004610dcb565b6106ea565b6100e76101a2366004610dcb565b61076c565b6100e76101b5366004610ee5565b6107ee565b6100e76101c8366004610dcb565b610843565b3360006101d9826108c5565b60048111156101ea576101ea610f3f565b146102105760405162461bcd60e51b815260040161020790610f9c565b60405180910390fd5b856001600160a01b0316878b6001600160a01b03167fb599fff20cd0cdacf6eba4e160e8d8009e20988c1eae26a9adbacd0825e57fe68c8c8a8a8a8a60405161025e96959493929190610fc1565b60405180910390a450505050505050505050565b33600061027e826108c5565b600481111561028f5761028f610f3f565b146102ac5760405162461bcd60e51b815260040161020790610f9c565b8160068111156102be576102be610f3f565b868a6001600160a01b03167fc5afeb842b1ee0a786f0181fd50d600ada6f7182ac63862b96f7f442770648b28b8b8a8a8a60405161030095949392919061101b565b60405180910390a4505050505050505050565b33600061031f826108c5565b600481111561033057610330610f3f565b1461034d5760405162461bcd60e51b815260040161020790610f9c565b85876001600160a01b03168a6001600160a01b03167f24eb4b3ed711873687e910758f75270c9463ed43b0ed071bdd590a4300bcd88e8b89898989604051610300959493929190611067565b3360006103a5826108c5565b60048111156103b6576103b6610f3f565b146103d35760405162461bcd60e51b815260040161020790610f9c565b846001600160a01b0316868a6001600160a01b03167f9508ec25b144da066199b5989b94395f140d3fa4b4b89d9d1fe759b3a56207818b8b8989896040516103009594939291906110a4565b33600061042b826108c5565b600481111561043c5761043c610f3f565b146104595760405162461bcd60e51b815260040161020790610f9c565b82856001600160a01b0316896001600160a01b03167fd9aab4ab40bdf963884f8195430dfa8cfb4f612db68e77014f08b1572104386d8a8a89886040516104a394939291906110e6565b60405180910390a45050505050505050565b3360006104c1826108c5565b60048111156104d2576104d2610f3f565b146104ef5760405162461bcd60e51b815260040161020790610f9c565b846001600160a01b0316868a6001600160a01b03167fff4bb47ee7dfdeaa91aa6bb72cb414f4a5417cb8b7856c50518377140a76f84f8b8b898989604051610300959493929190611124565b336000610547826108c5565b600481111561055857610558610f3f565b146105755760405162461bcd60e51b815260040161020790610f9c565b82876001600160a01b03167f6dea70ae06d45c8fa6812244450ca27a1739b5ff5959d5d78e175529596fdf4a888888876040516105b594939291906110e6565b60405180910390a350505050505050565b3360006105d2826108c5565b60048111156105e3576105e3610f3f565b146106005760405162461bcd60e51b815260040161020790610f9c565b84866001600160a01b0316886001600160a01b03167f9ae6f0a8ca0d7d683b3c09bd0ae5753f0e32122471cfd78314043b23098a6c248787876040516106489392919061113f565b60405180910390a450505050505050565b336000610665826108c5565b600481111561067657610676610f3f565b146106935760405162461bcd60e51b815260040161020790610f9c565b836001600160a01b0316866001600160a01b03167f3ec02074dff7cee356720b1f6e201d35ea87c45961d9d9e3cc4ff52147908bc28786866040516106da9392919061119a565b60405180910390a3505050505050565b3360006106f6826108c5565b600481111561070757610707610f3f565b146107245760405162461bcd60e51b815260040161020790610f9c565b84866001600160a01b0316886001600160a01b03167f61f5631971566b3768bafba61e9d2a9b41fcffa03bd2a2c2226c2187b9d4fbb48787876040516106489392919061113f565b336000610778826108c5565b600481111561078957610789610f3f565b146107a65760405162461bcd60e51b815260040161020790610f9c565b84866001600160a01b0316886001600160a01b03167f2babdf2515139b15f37dbc4b16e25fe27d46327703abc50cd73c7acb5369e3cc8787876040516106489392919061113f565b81836001600160a01b0316866001600160a01b03167f34d6b4d35fa401c6a7d3efae588ddd17d510ceb459bf4af495f1498706fd44c187856040516108349291906111b5565b60405180910390a45050505050565b33600061084f826108c5565b600481111561086057610860610f3f565b1461087d5760405162461bcd60e51b815260040161020790610f9c565b82846001600160a01b0316886001600160a01b03167f106d24c70bbf2f6dbb6d5fa931e9951c1809fa791d8239136c544c36ecb6b8e88989876040516106489392919061113f565b60408051600481526024810182526020810180516001600160e01b0316630628d14f60e51b1790529051600091829182916001600160a01b0386169161090b9190611229565b6000604051808303816000865af19150503d8060008114610948576040519150601f19603f3d011682016040523d82523d6000602084013e61094d565b606091505b50915091508161096f5760405162461bcd60e51b815260040161020790611278565b8080602001905181019061098391906112a0565b949350505050565b60006001600160a01b0382165b92915050565b6109a78161098b565b81146109b257600080fd5b50565b80356109988161099e565b806109a7565b8035610998816109c0565b60008060008060008060008060006101208a8c0312156109f3576109f3600080fd5b60006109ff8c8c6109b5565b9950506020610a108c828d016109b5565b9850506040610a218c828d016109b5565b9750506060610a328c828d016109c6565b9650506080610a438c828d016109b5565b95505060a0610a548c828d016109c6565b94505060c0610a658c828d016109c6565b93505060e0610a768c828d016109c6565b925050610100610a888c828d016109c6565b9150509295985092959850929598565b600781106109b257600080fd5b803561099881610a98565b600080600080600080600080610100898b031215610ad057610ad0600080fd5b6000610adc8b8b6109b5565b9850506020610aed8b828c016109b5565b9750506040610afe8b828c016109b5565b9650506060610b0f8b828c016109c6565b9550506080610b208b828c016109c6565b94505060a0610b318b828c016109b5565b93505060c0610b428b828c016109c6565b92505060e0610b538b828c01610aa5565b9150509295985092959890939650565b600080600080600080600080610100898b031215610b8357610b83600080fd5b6000610b8f8b8b6109b5565b9850506020610ba08b828c016109b5565b9750506040610bb18b828c016109b5565b9650506060610bc28b828c016109c6565b9550506080610bd38b828c016109c6565b94505060a0610be48b828c016109c6565b93505060c0610bf58b828c016109c6565b92505060e0610b538b828c016109c6565b8015156109a7565b803561099881610c06565b600080600080600080600080610100898b031215610c3957610c39600080fd5b6000610c458b8b6109b5565b9850506020610c568b828c016109b5565b9750506040610c678b828c016109b5565b9650506060610c788b828c016109c6565b9550506080610c898b828c016109b5565b94505060a0610c9a8b828c016109c6565b93505060c0610cab8b828c016109c6565b92505060e0610b538b828c01610c0e565b600080600080600080600060e0888a031215610cda57610cda600080fd5b6000610ce68a8a6109b5565b9750506020610cf78a828b016109b5565b9650506040610d088a828b016109c6565b9550506060610d198a828b016109b5565b9450506080610d2a8a828b016109b5565b93505060a0610d3b8a828b016109c6565b92505060c0610d4c8a828b016109c6565b91505092959891949750929550565b600080600080600080600080610100898b031215610d7b57610d7b600080fd5b6000610d878b8b6109b5565b9850506020610d988b828c016109b5565b9750506040610da98b828c016109b5565b9650506060610dba8b828c016109c6565b9550506080610bd38b828c016109b5565b60008060008060008060c08789031215610de757610de7600080fd5b6000610df389896109b5565b9650506020610e0489828a016109b5565b9550506040610e1589828a016109c6565b9450506060610e2689828a016109b5565b9350506080610e3789828a016109c6565b92505060a0610e4889828a016109c6565b9150509295509295509295565b600281106109b257600080fd5b803561099881610e55565b600080600080600060a08688031215610e8857610e88600080fd5b6000610e9488886109b5565b9550506020610ea5888289016109b5565b9450506040610eb6888289016109b5565b9350506060610ec788828901610e62565b9250506080610ed8888289016109c6565b9150509295509295909350565b600080600080600060a08688031215610f0057610f00600080fd5b6000610f0c88886109b5565b9550506020610f1d888289016109b5565b9450506040610f2e888289016109b5565b9350506060610ec7888289016109c6565b634e487b7160e01b600052602160045260246000fd5b602781526000602082017f6576656e74456d69742063616e206f6e6c792062652063616c6c65642062792081526620bab1ba34b7b760c91b602082015291505b5060400190565b6020808252810161099881610f55565b610fb58161098b565b82525050565b80610fb5565b60c08101610fcf8289610fac565b610fdc6020830188610fac565b610fe96040830187610fbb565b610ff66060830186610fbb565b6110036080830185610fbb565b61101060a0830184610fbb565b979650505050505050565b60a081016110298288610fac565b6110366020830187610fac565b6110436040830186610fbb565b6110506060830185610fac565b61105d6080830184610fbb565b9695505050505050565b60a081016110758288610fac565b6110826020830187610fbb565b61108f6040830186610fbb565b6110506060830185610fbb565b801515610fb5565b60a081016110b28288610fac565b6110bf6020830187610fac565b6110cc6040830186610fbb565b6110d96060830185610fbb565b61105d608083018461109c565b608081016110f48287610fac565b6111016020830186610fbb565b61110e6040830185610fac565b61111b6060830184610fbb565b95945050505050565b60a081016111328288610fac565b6110826020830187610fac565b6060810161114d8286610fac565b61115a6020830185610fbb565b6109836040830184610fbb565b600281106109b2576109b2610f3f565b8061118181611167565b919050565b600061099882611177565b610fb581611186565b606081016111a88286610fac565b61115a6020830185611191565b604081016111c38285610fac565b6111d06020830184610fbb565b9392505050565b60005b838110156111f25781810151838201526020016111da565b83811115611201576000848401525b50505050565b6000611211825190565b61121f8185602086016111d7565b9290920192915050565b60006111d08284611207565b602681526000602082017f556e61626c6520746f2064657465726d696e652074686520636f6e747261637481526520747970652160d01b60208201529150610f95565b6020808252810161099881611235565b600581106109b257600080fd5b805161099881611288565b6000602082840312156112b5576112b5600080fd5b6000610983848461129556fea264697066735822122088f63d9cb133fcbe483822e104f2f12b11d88efc622f185be02fd35592d4a28464736f6c63430008080033",
  "devdoc": {
    "kind": "dev",
    "methods": {},
    "version": 1
  },
  "userdoc": {
    "kind": "user",
    "methods": {},
    "version": 1
  },
  "storageLayout": {
    "storage": [],
    "types": null
  }
}